### ISSUE TITLE
IPv6 не работает SOCKS, но работает обычный HTTP(S)

### ISSUE THREAD

**Issue by Piduna** [z3APA3A/3proxy#112]
Добрый день, спасибо Вам большое за написанный проект, а теперь немного о проблемах.
Вопрос возник при работе пакета прокси версии 0.8.6 и 0.8.7. Система Debian 7.11. 
При попытки соединения через http(s) все хорошо, но при попытке соединения через socks, пользователь проходит аутентификацию и все, дальше timeout.
Кусок конфига:

nserver <IP6>
nserver <IP6>
nscache 65536
timeouts 1 5 30 60 180 1800 15 60
internal <IP4>

daemon
pidfile /usr/local/3proxy.pid
logformat "L%C - %U [%d/%o/%Y:%H:%M:%S %z] ""%T"" %E %I %O %N/%R:%r"
log /var/log/3proxy

auth strong

users test:CL:test

flush
auth iponly strong
deny * * * 25,2525 * * *
allow test
proxy -6 -n -a -i<IP4> -e<IP6> -p15996
socks -6 -n -a -i<IP4> -e<IP6> -p33721

В логах ничего не пишет, а после того, как я в Proxyfier нажимаю STOP testing, вижу, что соединение прошло. Ну и в браузере естественно ничего по  socks  не работает. Спасибо, за внимание. Решается ли этот вопрос ?

**Comment by z3APA3A** [comment]
Что именно пишет в логах? Умеет ли проксификатор отлавливать разрешение имен и делать подмену имен для SOCKS? Если не умеет, то клиент будет сам разрешать имена, скорей всего в IPv4 адрес, и запрашивать подключение к IPv4 а не к IPv6 адресу.

**Comment by Piduna** [comment]
82.207.120.83 - silver [04/Nov/2016:12:36:11 +0300] "CONNECT www.google.com:80" 00094 0 0 SOCK5/2a00:1450:4005:80a::2004:80
82.207.120.83 - silver [04/Nov/2016:12:44:05 +0300] "CONNECT www.google.com:80" 00000 0 0 SOCK5/2a00:1450:4005:80a::2004:80
82.207.120.83 - silver [04/Nov/2016:13:08:57 +0300] "CONNECT www.google.com:80" 00000 0 0 SOCK5/2a00:1450:4013:c03::93:80
82.207.120.83 - silver [04/Nov/2016:13:16:11 +0300] "CONNECT www.google.com:80" 00000 0 0 SOCK5/2a00:1450:4005:80a::2004:80
82.207.120.83 - silver [04/Nov/2016:17:28:58 +0300] "CONNECT www.google.com:80" 00000 0 0 SOCK5/2a00:1450:4005:80a::2004:80
82.207.120.83 - silver [04/Nov/2016:17:33:52 +0300] "CONNECT www.google.com:80" 00094 0 0 SOCK5/2a00:1450:4005:80a::2004:80

**Comment by Piduna** [comment]
46.29.161.122 - - [04/Nov/2016:17:20:01 +0300] "Accepting connections [21654/1703282432]" 00000 0 0 SOCKS/2a00:b700:1::2b7:0
46.29.161.122 - - [04/Nov/2016:17:20:01 +0300] "Accepting connections [21654/1687160576]" 00000 0 0 SOCKS/2a00:b700:1::2b8:0
46.29.161.122 - - [04/Nov/2016:17:20:01 +0300] "Accepting connections [21654/1718720256]" 00000 0 0 SOCKS/2a00:b700:1::2b9:0
46.29.161.122 - - [04/Nov/2016:17:20:01 +0300] "Accepting connections [21654/1718556416]" 00000 0 0 SOCKS/2a00:b700:1::2ba:0
46.29.161.122 - - [04/Nov/2016:17:20:01 +0300] "Accepting connections [21654/1700857600]" 00000 0 0 SOCKS/2a00:b700:1::2bb:0
46.29.161.122 - - [04/Nov/2016:17:20:01 +0300] "Accepting connections [21654/1703053056]" 00000 0 0 SOCKS/2a00:b700:1::2bc:0
46.29.161.122 - - [04/Nov/2016:17:20:01 +0300] "Accepting connections [21654/1709549312]" 00000 0 0 SOCKS/2a00:b700:1::2bd:0
46.29.161.122 - - [04/Nov/2016:17:20:01 +0300] "Accepting connections [21654/1686996736]" 00000 0 0 SOCKS/2a00:b700:1::2be:0
46.29.161.122 - - [04/Nov/2016:17:20:01 +0300] "Accepting connections [21654/1692862208]" 00000 0 0 SOCKS/2a00:b700:1::2bf:0
46.29.161.122 - - [04/Nov/2016:17:20:01 +0300] "Accepting connections [21654/1695844096]" 00000 0 0 SOCKS/2a00:b700:1::2c0:0
46.29.161.122 - - [04/Nov/2016:17:20:01 +0300] "Accepting connections [21654/1704666880]" 00000 0 0 SOCKS/2a00:b700:1::2c1:0
46.29.161.122 - - [04/Nov/2016:17:20:01 +0300] "Accepting connections [21654/1704699648]" 00000 0 0 SOCKS/2a00:b700:1::2c2:0
46.29.161.122 - - [04/Nov/2016:17:20:01 +0300] "Accepting connections [21654/1700103936]" 00000 0 0 SOCKS/2a00:b700:1::2c3:0
46.29.161.122 - - [04/Nov/2016:17:20:01 +0300] "Accepting connections [21654/1686963968]" 00000 0 0 SOCKS/2a00:b700:1::2c4:0
46.29.161.122 - - [04/Nov/2016:17:20:01 +0300] "Accepting connections [21654/1702987520]" 00000 0 0 SOCKS/2a00:b700:1::2c5:0
46.29.161.122 - - [04/Nov/2016:17:20:01 +0300] "Accepting connections [21654/1706665728]" 00000 0 0 SOCKS/2a00:b700:1::2c6:0
46.29.161.122 - - [04/Nov/2016:17:20:01 +0300] "Accepting connections [21654/1694664448]" 00000 0 0 SOCKS/2a00:b700:1::2c7:0
46.29.161.122 - - [04/Nov/2016:17:20:01 +0300] "Accepting connections [21654/1719342848]" 00000 0 0 SOCKS/2a00:b700:1::2c8:0
46.29.161.122 - - [04/Nov/2016:17:20:01 +0300] "Accepting connections [21654/1689061120]" 00000 0 0 SOCKS/2a00:b700:1::2c9:0
46.29.161.122 - - [04/Nov/2016:17:20:01 +0300] "Accepting connections [21654/1694205696]" 00000 0 0 SOCKS/2a00:b700:1::2ca:0
46.29.161.122 - - [04/Nov/2016:17:20:01 +0300] "Accepting connections [21654/1697908480]" 00000 0 0 SOCKS/2a00:b700:1::2cb:0
46.29.161.122 - - [04/Nov/2016:17:20:01 +0300] "Accepting connections [21654/1691584256]" 00000 0 0 SOCKS/2a00:b700:1::2cc:0
46.29.161.122 - - [04/Nov/2016:17:20:01 +0300] "Accepting connections [21654/1698039552]" 00000 0 0 SOCKS/2a00:b700:1::2cd:0
46.29.161.122 - - [04/Nov/2016:17:20:01 +0300] "Accepting connections [21654/1698137856]" 00000 0 0 SOCKS/2a00:b700:1::2ce:0
46.29.161.122 - - [04/Nov/2016:17:20:01 +0300] "Accepting connections [21654/1701611264]" 00000 0 0 SOCKS/2a00:b700:1::2cf:0
46.29.161.122 - - [04/Nov/2016:17:20:01 +0300] "Accepting connections [21654/1718163200]" 00000 0 0 SOCKS/2a00:b700:1::2d0:0
46.29.161.122 - - [04/Nov/2016:17:20:01 +0300] "Accepting connections [21654/1693222656]" 00000 0 0 SOCKS/2a00:b700:1::2d1:0
46.29.161.122 - - [04/Nov/2016:17:20:01 +0300] "Accepting connections [21654/1707124480]" 00000 0 0 SOCKS/2a00:b700:1::2d2:0
46.29.161.122 - - [04/Nov/2016:17:20:01 +0300] "Accepting connections [21654/1692632832]" 00000 0 0 SOCKS/2a00:b700:1::2d3:0
46.29.161.122 - - [04/Nov/2016:17:20:01 +0300] "Accepting connections [21654/1687062272]" 00000 0 0 SOCKS/2a00:b700:1::2d4:0

**Comment by Piduna** [comment]
Спасибо еще раз за Ваше внимание

**Comment by z3APA3A** [comment]
Cоединение прошло успешно но какого-либо запроса со стороны клиента после установки соединения не пришло, т.е. данные между клиентом и сервером не передавались. Либо клиент не видит, что соединение было установлено, либо проксификатор не передает данные от клиента в прокси, в любом случае, видимо, проблему стоит искать в проксификаторе.

**Comment by z3APA3A** [comment]
Чтобы исключить прокси, можно проснифать трафик между клиентом и прокси-сервером.

**Comment by Piduna** [comment]
94 - ошибка получения данных от клиента

**Comment by Piduna** [comment]
82.207.120.83 - silver [04/Nov/2016:17:33:52 +0300] "CONNECT www.google.com:80" 00094 0 0 SOCK5/2a00:1450:4005:80a::2004:80

**Comment by Piduna** [comment]
Это уже через браузер соединение

**Comment by Piduna** [comment]
Может что-то не так в конфигурационном файле ?

**Comment by Piduna** [comment]
46.29.161.122 - - [04/Nov/2016:12:40:01 +0300] "bind(): Address already in use" 00000 0 0 SOCKS/2a00:b700:1::4cb:0
46.29.161.122 - - [04/Nov/2016:12:40:01 +0300] "Exiting thread" 00000 0 0 SOCKS/2a00:b700:1::4cb:0
46.29.161.122 - - [04/Nov/2016:12:40:01 +0300] "Accepting connections [15925/3382564608]" 00000 0 0 SOCKS/2a00:b700:1::4cb:0
46.29.161.122 - - [04/Nov/2016:12:50:01 +0300] "bind(): Address already in use" 00000 0 0 SOCKS/2a00:b700:1::4cb:0
46.29.161.122 - - [04/Nov/2016:12:50:01 +0300] "bind(): Address already in use" 00000 0 0 SOCKS/2a00:b700:1::4cb:0
46.29.161.122 - - [04/Nov/2016:12:50:01 +0300] "bind(): Address already in use" 00000 0 0 SOCKS/2a00:b700:1::4cb:0
46.29.161.122 - - [04/Nov/2016:12:50:02 +0300] "Exiting thread" 00000 0 0 SOCKS/2a00:b700:1::4cb:0
46.29.161.122 - - [04/Nov/2016:12:50:02 +0300] "Accepting connections [15925/3382826752]" 00000 0 0 SOCKS/2a00:b700:1::4cb:0
46.29.161.122 - - [04/Nov/2016:13:00:01 +0300] "bind(): Address already in use" 00000 0 0 SOCKS/2a00:b700:1::4cb:0
46.29.161.122 - - [04/Nov/2016:13:00:01 +0300] "Exiting thread" 00000 0 0 SOCKS/2a00:b700:1::4cb:0
46.29.161.122 - - [04/Nov/2016:13:00:01 +0300] "Accepting connections [15925/3395712768]" 00000 0 0 SOCKS/2a00:b700:1::4cb:0
46.29.161.122 - - [04/Nov/2016:13:00:44 +0300] "Accepting connections [21051/1155839744]" 00000 0 0 SOCKS/2a00:b700:1::4cb:0
46.29.161.122 - - [04/Nov/2016:13:01:42 +0300] "Accepting connections [21654/1719113472]" 00000 0 0 SOCKS/2a00:b700:1::4cb:0
46.29.161.122 - - [04/Nov/2016:13:10:01 +0300] "Exiting thread" 00000 0 0 SOCKS/2a00:b700:1::4cb:0
46.29.161.122 - - [04/Nov/2016:13:10:01 +0300] "Accepting connections [21654/1718490880]" 00000 0 0 SOCKS/2a00:b700:1::4cb:0
46.29.161.122 - - [04/Nov/2016:13:20:01 +0300] "bind(): Address already in use" 00000 0 0 SOCKS/2a00:b700:1::4cb:0
46.29.161.122 - - [04/Nov/2016:13:20:01 +0300] "bind(): Address already in use" 00000 0 0 SOCKS/2a00:b700:1::4cb:0
46.29.161.122 - - [04/Nov/2016:13:20:01 +0300] "bind(): Address already in use" 00000 0 0 SOCKS/2a00:b700:1::4cb:0
46.29.161.122 - - [04/Nov/2016:13:20:02 +0300] "Exiting thread" 00000 0 0 SOCKS/2a00:b700:1::4cb:0
46.29.161.122 - - [04/Nov/2016:13:20:02 +0300] "Accepting connections [21654/1698596608]" 00000 0 0 SOCKS/2a00:b700:1::4cb:0
46.29.161.122 - - [04/Nov/2016:13:30:01 +0300] "bind(): Address already in use" 00000 0 0 SOCKS/2a00:b700:1::4cb:0
46.29.161.122 - - [04/Nov/2016:13:30:01 +0300] "Exiting thread" 00000 0 0 SOCKS/2a00:b700:1::4cb:0
46.29.161.122 - - [04/Nov/2016:13:30:01 +0300] "Accepting connections [21654/1692108544]" 00000 0 0 SOCKS/2a00:b700:1::4cb:0
46.29.161.122 - - [04/Nov/2016:13:40:01 +0300] "bind(): Address already in use" 00000 0 0 SOCKS/2a00:b700:1::4cb:0
46.29.161.122 - - [04/Nov/2016:13:40:01 +0300] "bind(): Address already in use" 00000 0 0 SOCKS/2a00:b700:1::4cb:0
46.29.161.122 - - [04/Nov/2016:13:40:02 +0300] "bind(): Address already in use" 00000 0 0 SOCKS/2a00:b700:1::4cb:0
46.29.161.122 - - [04/Nov/2016:13:40:02 +0300] "Exiting thread" 00000 0 0 SOCKS/2a00:b700:1::4cb:0
46.29.161.122 - - [04/Nov/2016:13:40:02 +0300] "Accepting connections [21654/1696958208]" 00000 0 0 SOCKS/2a00:b700:1::4cb:0
46.29.161.122 - - [04/Nov/2016:13:50:01 +0300] "bind(): Address already in use" 00000 0 0 SOCKS/2a00:b700:1::4cb:0
46.29.161.122 - - [04/Nov/2016:13:50:01 +0300] "Exiting thread" 00000 0 0 SOCKS/2a00:b700:1::4cb:0
46.29.161.122 - - [04/Nov/2016:13:50:01 +0300] "Accepting connections [21654/1698596608]" 00000 0 0 SOCKS/2a00:b700:1::4cb:0
46.29.161.122 - - [04/Nov/2016:14:00:01 +0300] "bind(): Address already in use" 00000 0 0 SOCKS/2a00:b700:1::4cb:0
46.29.161.122 - - [04/Nov/2016:14:00:01 +0300] "bind(): Address already in use" 00000 0 0 SOCKS/2a00:b700:1::4cb:0
46.29.161.122 - - [04/Nov/2016:14:00:02 +0300] "bind(): Address already in use" 00000 0 0 SOCKS/2a00:b700:1::4cb:0
46.29.161.122 - - [04/Nov/2016:14:00:02 +0300] "Exiting thread" 00000 0 0 SOCKS/2a00:b700:1::4cb:0
46.29.161.122 - - [

**Comment by Piduna** [comment]
это сугубо по ИП/сокс порт

**Comment by z3APA3A** [comment]
Посмотри трафик между клиентом и сервером tcpdump'ом

**Comment by Piduna** [comment]
вообще никакого трафика. ноль. но, когда я пробовал с внешнего айпишника заходить, который не за роутером. не за каким-либо еще маршрутизатором. с горем пополам, я заходил

proxyfier показывал вот что:
[11.05 12:55:43] firefox.exe - www.tns-counter.ru:443 error : Could not connect through proxy 46.29.161.122:33309 - Proxy server cannot establish a connection with the target - Connection refused.
[11.05 12:55:43] firefox.exe - www.yandex.ru:443 (IPv6) open through proxy 46.29.161.122:33309 SOCKS5

вот дамп. по нему все впорядке, соединение идет
09:45:28.790522 IP6 (hlim 57, next-header TCP (6) payload length: 20) www.yandex.ru.https > 2a00:b700:1::310.45390: Flags [.], cksum 0xbc52 (correct), seq 6789, ack 426, win 37, length 0
09:45:28.790556 IP6 (hlim 57, next-header TCP (6) payload length: 61) www.yandex.ru.https > 2a00:b700:1::310.45390: Flags [P.], cksum 0x4810 (correct), seq 6789:6830, ack 426, win 37, length 41
09:45:28.790579 IP6 (flowlabel 0xab453, hlim 64, next-header TCP (6) payload length: 20) 2a00:b700:1::310.45390 > www.yandex.ru.https: Flags [.], cksum 0xbbf7 (correct), seq 426, ack 6830, win 87, length 0
09:45:34.776236 IP6 (flowlabel 0x6f30b, hlim 64, next-header TCP (6) payload length: 61) 2a00:b700:1::310.33925 > static.yandex.net.https: Flags [P.], cksum 0xd37e (correct), seq 1760:1801, ack 41194, win 221, length 41
09:45:34.795357 IP6 (hlim 56, next-header TCP (6) payload length: 61) static.yandex.net.https > 2a00:b700:1::310.33925: Flags [P.], cksum 0xbadf (correct), seq 41194:41235, ack 1801, win 35, length 41
09:45:34.795429 IP6 (flowlabel 0x6f30b, hlim 64, next-header TCP (6) payload length: 20) 2a00:b700:1::310.33925 > static.yandex.net.https: Flags [.], cksum 0x0e06 (correct), seq 1801, ack 41235, win 221, length 0
09:45:35.774204 IP6 (flowlabel 0x2b3f8, hlim 64, next-header TCP (6) payload length: 61) 2a00:b700:1::310.43963 > static.yandex.net.https: Flags [P.], cksum 0x0624 (correct), seq 936:977, ack 12420, win 109, length 41
09:45:35.793103 IP6 (hlim 57, next-header TCP (6) payload length: 61) static.yandex.net.https > 2a00:b700:1::310.43963: Flags [P.], cksum 0x4d89 (correct), seq 12420:12461, ack 977, win 32, length 41
09:45:35.793170 IP6 (flowlabel 0x2b3f8, hlim 64, next-header TCP (6) payload length: 20) 2a00:b700:1::310.43963 > static.yandex.net.https: Flags [.], cksum 0xa502 (correct), seq 977, ack 12461, win 109, length 0
09:45:44.090730 IP6 (hlim 55, next-header TCP (6) payload length: 63) mc.yandex.ru.https > 2a00:b700:1::310.52626: Flags [P.], cksum 0xffdb (correct), seq 7823:7854, ack 1148, win 66, options [nop,nop,TS val 466187071 ecr 62425090], length 31
09:45:44.090791 IP6 (flowlabel 0x2705a, hlim 64, next-header TCP (6) payload length: 32) 2a00:b700:1::310.52626 > mc.yandex.ru.https: Flags [.], cksum 0x7d24 (correct), seq 1148, ack 7854, win 95, options [nop,nop,TS val 62441340 ecr 466187071], length 0
09:45:44.090872 IP6 (hlim 55, next-header TCP (6) payload length: 32) mc.yandex.ru.https > 2a00:b700:1::310.52626: Flags [F.], cksum 0xbcba (correct), seq 7854, ack 1148, win 66, options [nop,nop,TS val 466187071 ecr 62425090], length 0
09:45:44.091090 IP6 (flowlabel 0x2705a, hlim 64, next-header TCP (6) payload length: 32) 2a00:b700:1::310.52626 > mc.yandex.ru.https: Flags [F.], cksum 0x7d22 (correct), seq 1148, ack 7855, win 95, options [nop,nop,TS val 62441340 ecr 466187071], length 0
09:45:44.117726 IP6 (hlim 55, next-header TCP (6) payload length: 32) mc.yandex.ru.https > 2a00:b700:1::310.52626: Flags [.], cksum 0x7d38 (correct), seq 7855, ack 1149, win 66, options [nop,nop,TS val 466187078 ecr 62441340], length 0
09:45:44.223384 IP6 (hlim 55, next-header TCP (6) payload length: 63) mc.yandex.ru.https > 2a00:b700:1::310.54037: Flags [P.], cksum 0x9385 (correct), seq 34060:34091, ack 1894, win 75, options [nop,nop,TS val 989183213 ecr 62425123], length 31
09:45:44.223427 IP6 (flowlabel 0x7f88e, hlim 64, next-header TCP (6) payload length: 32) 2a00:b700:1::310.54037 > mc.yandex.ru.https: Flags [.], cksum 0xfb89 (correct), seq 1894, ack 34091, win 203, options [nop,nop,TS val 62441373 ecr 989183213], length 0
09:45:44.223537 IP6 (hlim 55, next-header TCP (6) payload length: 32) mc.yandex.ru.https > 2a00:b700:1::310.54037: Flags [F.], cksum 0x3b83 (correct), seq 34091, ack 1894, win 75, options [nop,nop,TS val 989183213 ecr 62425123], length 0
09:45:44.223695 IP6 (flowlabel 0x7f88e, hlim 64, next-header TCP (6) payload length: 32) 2a00:b700:1::310.54037 > mc.yandex.ru.https: Flags [F.], cksum 0xfb86 (correct), seq 1894, ack 34092, win 203, options [nop,nop,TS val 62441374 ecr 989183213], length 0
09:45:44.249639 IP6 (hlim 55, next-header TCP (6) payload length: 32) mc.yandex.ru.https > 2a00:b700:1::310.54037: Flags [.], cksum 0xfbff (correct), seq 34092, ack 1895, win 75, options [nop,nop,TS val 989183220 ecr 62441374], length 0

но это, если с внешнего и тоже не без ошибок. а вот с того, который находится за nat ничего нет (если что фаервола нет и ничего не должно мешать):
[11.09 11:52:06] firefox.exe - www.mozilla.org:443 error : Could not connect through proxy 46.29.161.122:33309 - Proxy server cannot establish a connection with the target - Connection refused.
[11.09 11:52:06] firefox.exe - ya.ru:80 error : Could not connect through proxy 46.29.161.122:33309 - Proxy server cannot establish a connection with the target - Connection refused.
[11.09 11:52:07] firefox.exe - ya.ru:80 error : Could not connect through proxy 46.29.161.122:33309 - Proxy server cannot establish a connection with the target - Connection refused.
[11.09 11:52:07] firefox.exe - github.com:443 error : Could not connect through proxy 46.29.161.122:33309 - Proxy server cannot establish a connection with the target - Connection refused.
[11.09 11:52:08] firefox.exe - ya.ru:80 error : Could not connect through proxy 46.29.161.122:33309 - Proxy server cannot establish a connection with the target - Connection refused.
[11.09 11:52:08] firefox.exe - github.com:443 error : Could not connect through proxy 46.29.161.122:33309 - Proxy server cannot establish a connection with the target - Connection refused.
[11.09 11:52:09] firefox.exe - github.com:443 error : Could not connect through proxy 46.29.161.122:33309 - Proxy server cannot establish a connection with the target - Connection refused.

ну и в дампе вообще ничего соотвественно. Вы извините, что я Вас дергаю. если дело в проксификаторе, то как можно по моей ситуации, коннектиться к сокс5 через айпи6 ? может есть какой-то другой софт для тестирование. поделитесь, как Вы работали ?

напоминаю мой конфиг:

nserver <IP6>
nserver <IP6>
nscache 65536
timeouts 1 5 30 60 180 1800 15 60
internal <IP4>

daemon
pidfile /usr/local/3proxy.pid
logformat "L%C - %U [%d/%o/%Y:%H:%M:%S %z] ""%T"" %E %I %O %N/%R:%r"
log /var/log/3proxy

auth strong

users test:CL:test

flush
auth iponly strong
deny * * * 25,2525 * * *
allow test
proxy -6 -n -a -i<IP4> -e<IP6> -p15996
socks -6 -n -a -i<IP4> -e<IP6> -p33721

спасибо большое за внимание

**Comment by z3APA3A** [comment]
Если в логах 3proxy отсутствуют записи, это значит что клиент не может
подключиться к прокси, ищи проблемы в сети, NAT, фильтрации портов.

09.11.2016 12:57, Piduna пишет:
