### ISSUE TITLE
Вопросы, комментарии, багрепорты и запросы фич #7

### ISSUE THREAD

**Issue by z3APA3A** [z3APA3A/3proxy#468]
Запросы фич и багрепорты создавайте как issue, по-русски или по-английски.
Комментарии и вопросы можно создавать как issue или отправлять на 3proxy@3proxy.ru

Пожалуйста, прочитайте FAQ, How To и руководства прежде, чем задавать вопрос:
http://3proxy.ru/doc/
http://3proxy.ru/documents/

Начало в
#394 #332 #274 #245 #169 #12

**Comment by YellowSM** [comment]
А подскажите пожалуйста.
Хочу настроить socks прокси для uTorrent через TOR. Т.к. TOR не поддерживает udp-треккеры, решил использовать 3proxy socks как промежуточный прокси. Какие правила allow нужно прописать, чтобы TCP коннекты шли через TOR, а UDP напрямую?

Попробовал так:
```
allow * * * * CONNECT
parent 1000 socks5 127.0.0.1 9050
allow *
```
Вроде как что-то заработало, но в логах сыпятся ошибки "UDPMAP 0.0.0.0:0"
Что не так?

**Comment by z3APA3A** [comment]
для UDP маппинга обязательно надо задавать адреса внутреннего/внешнего интерфейса.

И лучше использовать socks5+ и добавить fakeresolve

**Comment by sanasol** [comment]
```
timeouts 1 5 30 60 180 1800 15 60

daemon

config config.conf
monitor config.conf

# start 10000-http
users userproxy:CL:pass
auth strong
allow *
fakeresolve
parent 1000 connect+ proxy_ip 8080 sanasol test
proxy -a -p10000
authcache ip 60
force
flush
# end 10000-http
```

Использую примерно такой конфиг.
Довольно часто нужно менять настройки.
У одного юзера(userproxy) и порта (10000) заменяю parent на другой.
Т.е parent всегда один с весом 1000, но он меняется.

```
parent 1000 connect+ proxy_ip 8080 sanasol test
parent 1000 connect+ proxy_ip2 8081 sanasol passwfa
parent 1000 socks5+ proxy_ip3 2344 someuser test
```

на выходе некоторые сайты долго и упорно продолжают отображать подключение как будто оно сделано через предыдущий parent.
Иногда показывает через раз, то новый parent, то старый.
По логам после изменения конфига reload уже сделан при этом.

Не могу понять коннекты всё равно держит так долго или что присходит.
Попробовад добавить force, но не заметил эффекта.
Может быть таймауты сделать меньше?

**Comment by z3APA3A** [comment]
Да, браузеры используют keep-alive подключения, т.е. серия запросов к одному серверу идет через один коннект. Время жизни неактивного keep-alive определяется CONNECTION_SHORT, но если активность есть постоянно, то соединение может продолжать жить долго.

**Comment by sanasol** [comment]
Так и предполагал.
Поставил таймауты по минимуму, полностью конечно не спасло, но вроде стало лучше.

Может есть способ при релоаде убивать старые соединения на уровне 3proxy?

**Comment by z3APA3A** [comment]
Вместо релоада запуска новый инстанс прокси, а старый после этого убивай.

**Comment by z3APA3A** [comment]
Но при этом, разумеется, у клиента может рваться соединение посредь передачи данных

**Comment by ezbik** [comment]
Я бы запустил пул ( неск. штук ) 3proxy, и посадил их за Haproxy.
Тогда 3proxy можно именно рестартовать ( сначала первую половину пула, потом вторую), и при этом клиент будет испытывать разрыв текущих соединений, но не будет у него проблем установить новые.

**Comment by z3APA3A** [comment]
Если сделать именно в такой последовательности:

> Вместо релоада запуска новый инстанс прокси, а старый после этого убивай

то проблем с установкой новых соединений тоже не будет

**Comment by sanasol** [comment]
> Вместо релоада запуска новый инстанс прокси, а старый после этого убивай

Так новый-то не запущу пока старый занимает порт. Или я чего-то не знаю?)

> Я бы запустил пул ( неск. штук ) 3proxy, и посадил их за Haproxy.

тоже подумываю сделать пул 3proxy и рестарты тогда пофиг вообще потому что они делаются пользователем с ожидаемыми последствиями. А пока один процесс, это будет больно для других, точнее есть шанс кому-то помешать.

**Comment by t4kq1995** [comment]
@z3APA3A привет
Подскажи пожалуйста - при попытке зайти на facebook.com через 3proxy (firefox) получил ошибку (An error occurred during a connection to www.facebook.com. PR_END_OF_FILE_ERROR)

В логах 3proxy
```
200515154332.234 50001 00401 - 191.101.250.82:45004 192.168.1.100:0 0 0 0 UNKNOWN 0.0.0.0:0
200515154332.247 50001 00092 TProxy 191.101.250.82:62715 31.13.84.36:443 1625 794 0 CONNECT www.facebook.com:443 HTTP/1.1
```

**Comment by t4kq1995** [comment]
@z3APA3A так же использовал https://proxy6.net/en/checker этот сервис для проверки работы, и из 4 проверок - одна failed.

В логах
```
200515154436.470 50001 00401 - 191.101.250.82:45570 192.168.1.100:0 0 0 0 UNKNOWN 0.0.0.0:0
200515154506.531 50001 00401 - 91.228.155.195:7254 192.168.1.100:0 0 0 0 UNKNOWN 0.0.0.0:0
200515154507.140 50001 00000 TProxy 91.228.155.195:7256 5.187.6.13:80 83 142 0 CONNECT pcode.info:80
200515154508.576 50001 00401 - 91.228.155.195:7380 192.168.1.100:0 0 0 0 UNKNOWN 0.0.0.0:0
200515154509.040 50001 00000 TProxy 91.228.155.195:7394 5.187.6.13:80 83 142 0 CONNECT pcode.info:80
200515154510.377 50001 00401 - 91.228.155.195:7484 192.168.1.100:0 0 0 0 UNKNOWN 0.0.0.0:0
200515154510.791 50001 00000 TProxy 91.228.155.195:7486 5.187.6.13:80 83 142 0 CONNECT pcode.info:80
200515154511.899 50001 00401 - 91.228.155.195:7578 192.168.1.100:0 0 0 0 UNKNOWN 0.0.0.0:0
200515154516.949 50001 00511 - 91.228.155.195:7590 192.168.1.100:0 0 0 0 

```

**Comment by z3APA3A** [comment]
https://3proxy.ru/howtor.asp#ERRORS

видимо, ты настроил слишком маленький таймаут CONNECTION_LONG.

**Comment by t4kq1995** [comment]
@z3APA3A привет снова
все равно настигают меня ошибки. Вот лог
```
200520124402.817 50001 00000 TProxy 191.101.250.82:49082 216.58.215.100:443 0 0 0 CONNECT www.google.com:443 HTTP/1.1
200520124403.606 50001 00401 - 191.101.250.82:49086 192.168.1.100:0 0 0 0 UNKNOWN 0.0.0.0:0
200520124406.603 50001 00511 - 191.101.250.82:60445 192.168.1.100:0 0 0 0 
200520124407.222 50001 00100 - 191.101.250.82:49016 0.0.0.0:0 0 0 0 CONNECT static.xx.fbcdn.net:443 HTTP/1.1
200520124407.604 50001 00401 - 191.101.250.82:49094 192.168.1.100:0 0 0 0 UNKNOWN 0.0.0.0:0
200520124408.611 50001 00511 - 191.101.250.82:60447 192.168.1.100:0 0 0 0 
200520124408.856 50001 00401 - 191.101.250.82:49104 192.168.1.100:0 0 0 0 UNKNOWN 0.0.0.0:0
200520124408.858 50001 00401 - 191.101.250.82:49100 192.168.1.100:0 0 0 0 UNKNOWN 0.0.0.0:0
200520124409.391 50001 00401 - 191.101.250.82:49088 192.168.1.100:0 0 0 0 UNKNOWN 0.0.0.0:0
200520124409.641 50001 00000 TProxy 191.101.250.82:49102 77.52.0.18:443 1316 4623 0 CONNECT video.fiev17-1.fna.fbcdn.net:443 HTTP/1.1
200520124409.681 50001 00000 TProxy 191.101.250.82:49096 77.52.0.18:443 1303 4668 0 CONNECT video.fiev17-1.fna.fbcdn.net:443 HTTP/1.1
200520124409.724 50001 00000 TProxy 191.101.250.82:49106 77.52.0.18:443 1320 20180 0 CONNECT video.fiev17-1.fna.fbcdn.net:443 HTTP/1.1
200520124410.204 50001 00401 - 191.101.250.82:49114 192.168.1.100:0 0 0 0 UNKNOWN 0.0.0.0:0
200520124410.279 50001 00401 - 191.101.250.82:49090 192.168.1.100:0 0 0 0 UNKNOWN 0.0.0.0:0
200520124410.635 50001 00401 - 191.101.250.82:49116 192.168.1.100:0 0 0 0 UNKNOWN 0.0.0.0:0
200520124414.285 50001 00401 - 191.101.250.82:60487 192.168.1.100:0 0 0 0 UNKNOWN 0.0.0.0:0
200520124415.840 50001 00401 - 191.101.250.82:49120 192.168.1.100:0 0 0 0 UNKNOWN 0.0.0.0:0
200520124415.847 50001 00401 - 191.101.250.82:49122 192.168.1.100:0 0 0 0 UNKNOWN 0.0.0.0:0
200520124416.883 50001 00401 - 191.101.250.82:49126 192.168.1.100:0 0 0 0 UNKNOWN 0.0.0.0:0
200520124417.050 50001 00000 TProxy 191.101.250.82:60424 216.58.208.206:443 1250 4401 0 CONNECT youtube.com:443 HTTP/1.1
```

![Screenshot from 2020-05-20 15-45-29](https://user-images.githubusercontent.com/13609002/82447421-f5624080-9ab0-11ea-8173-1711f911381d.png)

Вот конфиг
```
#! /usr/local/bin/3proxy
daemon
nserver 192.168.1.1
nscache 65536
timeouts 1 5 30 60 180 1800 15 60
users TProxy:CL:moNEnTIM
log /var/log/3proxy_1.log
auth strong
allow TProxy
proxy -n -a -p50001 -i192.168.0.100 -e192.168.1.100
socks -n -a -p50001 -i192.168.0.100 -e192.168.1.100
flush
```

Помоги пожалуйста, в чем могут быть проблемы

**Comment by z3APA3A** [comment]
так с каким сайтом такая ошибка?
а вообще - у тебя запущен socks и proxy на одном порту. Не понимаю какого эффекта ты хотел этим добиться, но ничего хорошего из этого точно не получится.

**Comment by t4kq1995** [comment]
@z3APA3A 
Сайт - https://www.youtube.com/

Лог
```
200520130518.836 50001 00401 - 191.101.250.82:49612 192.168.1.100:0 0 0 0 UNKNOWN 0.0.0.0:0
200520130525.367 50001 00401 - 191.101.250.82:49632 192.168.1.100:0 0 0 0 UNKNOWN 0.0.0.0:0
```

Ошибка - PR_END_OF_FILE_ERROR

Конфиг поменял на 
```
#! /usr/local/bin/3proxy
daemon
nserver 192.168.1.1
nscache 65536
timeouts 1 5 30 60 180 1800 15 60
users TProxy:CL:moNEnTIM
log /var/log/3proxy_1.log
auth strong
allow TProxy
proxy -n -a -p50001 -i192.168.0.100 -e192.168.1.100
socks -n -a -p40001 -i192.168.0.100 -e192.168.1.100
flush
```

**Comment by z3APA3A** [comment]
401 это ошибка SOCKS, у тебя HTTP запрос пришел в SOCKS сервер, что было ожидаемо, поскольку SOCKS запущен на том же порту.

**Comment by t4kq1995** [comment]
@z3APA3A так я же поменял конфиг
```
proxy -n -a -p50001 -i192.168.0.100 -e192.168.1.100
socks -n -a -p40001 -i192.168.0.100 -e192.168.1.100
```

**Comment by z3APA3A** [comment]
так а прокси-то ты порестартил?

**Comment by tishkovets** [comment]
Здравствуйте.

Есть несколько tun интерфейсов, которые периодически меняются. Подскажите, пожалуйста, куда копать, чтобы настроить 3proxy рандомно использовать один из них

**Comment by z3APA3A** [comment]
Повесить if-up/if-down скрипты на подъем и отключение интерфейса, которые будут обновлять конфигурацию прокси.  А дальше смотря что значит "рандомно" и в какой момент эта рандомность должна определяться, возможно требуется
https://3proxy.ru/howtor.asp#ROUNDROBIN

**Comment by YaroslVozl** [comment]
Привет ребят. Я хочу поднять /32 ipv6 подсеть. У меня есть несколько вопросов(новичок в этом) был бы очень благодарен некоторой помощи. @comshelix (telegram) 
Надеюсь не сильно помешал своим комментом.

**Comment by merlinjk** [comment]
hi i had a problem when i want to deny and allow for a specific interfaces

#! /usr/local/bin/3proxy
daemon
nserver 8.8.8.8
nscache 65536
users test:CL:test
users admin:CLadmin
log /var/log/3proxy_1.log
auth strong
allow admin 192.168.0.10
deny test 192.168.0.10
deny admin 192.168.0.11
allow test 192.168.0.11
proxy -n -a -p3127 -i192.168.0.10 -e192.168.1.10
proxy -n -a -p3127 -i192.168.0.11 -e192.168.1.11
flush

**Comment by z3APA3A** [comment]
```
#allow/deny for proxy1
allow ...
deny ...
...
proxy
flush
#allow/deny for proxy 2
allow ...
deny ...
proxy

```

**Comment by merlinjk** [comment]
okay im gona try

**Comment by merlinjk** [comment]
is it possible to just allow users i want to a specific proxy and other get denied automatic or ?

**Comment by merlinjk** [comment]
because i have 250ip and i think i will die before i will finish the config

**Comment by z3APA3A** [comment]
You can use RADIUS authentication and/or you may want to generate config rathe than write it manually.

**Comment by jokedroid** [comment]
Может ли один конфиг содержать секцию с parent и без?  Объясню подробней:
Стандартный конфиг (разименование через указанный выше nameserver)
```
auth ...
users ...
allow *
proxy -p80
socks -p443
```
 Тепер продолжение конфига, где разименовываться и ходить должны через parent
```
flush
fakeresolve
auth ...
users ...
allow *
parent 1000 socks5+ 127.0.0.1 5548
proxy -p81
socks -p444
```
  Но так происходят "чудеса",  секция выше тоже пытается ходить через parent (видел в логах). 
  В одном конфиге их вообще можно разделить?

**Comment by z3APA3A** [comment]
Да, parent действует только на последнюю команду allow. Что именно ты видел в логах?

**Comment by z3APA3A** [comment]
Но конфигурация DNS и DNS кеша общая для всех прокси.

**Comment by ezbik** [comment]
И секция users тоже общая. Она не бьется flush.

**Comment by komato3huk** [comment]
Подскажите. Возможна ли пересылка между интерфейсами в windows? -De аналог в nix

**Comment by komato3huk** [comment]
После указания 
DefaultLimitDATA=infinity
DefaultLimitSTACK=infinity
DefaultLimitCORE=infinity
DefaultLimitRSS=infinity
DefaultLimitNOFILE=102400
DefaultLimitAS=infinity
DefaultLimitNPROC=10240
DefaultLimitMEMLOCK=infinity
В системе при трафике примерно 100мб/с проц уходит в 100% без этих параметров ухожу в ошибку 11 и 21
Прошу помощи в оптимизации

**Comment by pavdin** [comment]
В Dev версии есть лимиты на коннекты, к примеру:
connlim 100 60 * 127.0.0.1 (ограничить 100 коннектами в 60 сек)
Подскажите, пожалуйста, можно ли ограничить не по IP а по имени пользователя?

**Comment by sergiustheblack** [comment]
Столкнулся со странным поведением цепочек http прокси. Через браузер всё отрабатывет так, как надо, а вот curl и питонная библиотека requests останавливаются на входном прокси, то есть (для простоты я выбросил балансировку):
есть server1 с ip-адресом ip1. он принимает запросы клиентов и должен отдавать их по цепочке server2 с ip2. В браузере запросы к ifconfig.me отдают ip2. а curl или библиотека - ip1.
Конфиги следующие (только то, что относится к цепочкам и ACL):
server1:
```
flush
auth strong
maxconn 1000
# allow only HTTP and HTTPS traffic.
allow * * * 80-88,8080-8088 HTTP
allow * * * 443,8443 HTTPS
parent 1000 connect <ip2> 80 <chainuser> <chainpass>
proxy -n -p8080
```
на server2 только
```
flush
auth strong
maxconn 1000
# allow only HTTP and HTTPS traffic.
allow * * * 80-88,8080-8088 HTTP
allow * * * 443,8443 HTTPS
proxy -n -p8080
```
оба сервиса запущены в докере.

**Comment by z3APA3A** [comment]
parent дополняет последнюю команду allow, у тебя через parent идет только https.

**Comment by gasl20** [comment]
Здравствуйте
Подскажите пожалуйста
Есть 3прокси на вин сервере с таким конфигом:
`users username:CL:password
nserver 8.8.8.8
nserver 1.1.1.1
nscache 65536
timeouts 1 5 30 60 180 1800 15 60
logformat "L%C - %U [%d/%o/%Y:%H:%M:%S %z] ""%T"" %E %I %O %N/%R:%r"
log
auth strong
allow username
#auth iponly
#allow * 37.55.55.34
#deny *
proxy -a -p88009 `

Когда я к нему подключаюсь файрфоксом с андроида или win , файрфокс выводит поля логина и пароля для ввода и все начинает работать.
В принципе использую такую схему на любой вин машине.


А вот пришлось взять впс с centos7-64-vpn
И вот таким конфигом, и окно авторизации не появляется. На фин хоть плагин можно поставить для этого окна, а в андроиде нет такой возможности.

[root@server ~]# vi /etc/3proxy.cfg
nserver 8.8.8.8
nserver 1.1.1.1
nscache 65536
timeouts 1 5 30 60 180 1800 15 60
users username:CL:password
users username2:CL:password
daemon
log /dev/null
external 23.23.23.23 - реальный ип тут указан
internal 23.23.23.23 - тот же ип
auth strong
allow username,username2
socks -p5555
proxy -a -p6666

Помогите пожалуйста как это можно на андроиде сделать

**Comment by pavdin** [comment]
Подскажите пожалуйста. Сыпятся в логах вот такие ошибки:

[11/Jun/2020:06:57:55 +0300] - +_L1591847875.229 PROXY.1055 00021 user 1.112.15.32:54035 77.88.21.173:443 0 0 0 CONNECT api-maps.yandex.ru:443 HTTP/1.1
[11/Jun/2020:06:57:55 +0300] - +_L1591847875.359 PROXY.1055 00021 user 1.112.15.32:54042 35.186.228.179:443 0 0 0 CONNECT google-analytics.bi.owox.com:443 HTTP/1.1
[11/Jun/2020:06:57:55 +0300] - +_L1591847875.979 PROXY.1055 00021 user 1.112.15.32:54046 91.192.149.204:443 0 0 0 CONNECT autocontext.begun.ru:443 HTTP/1.1
[11/Jun/2020:06:57:55 +0300] - +_L1591847875.986 PROXY.1055 00021 user 1.112.15.32:54045 77.88.21.119:443 0 0 0 CONNECT mc.yandex.ru:443 HTTP/1.1
[11/Jun/2020:06:57:56 +0300] - +_L1591847876.585 PROXY.1055 00021 user 1.112.15.32:54051 178.132.201.52:443 0 0 0 CONNECT cdn.bitrix24.ru:443 HTTP/1.1
[11/Jun/2020:06:57:56 +0300] - +_L1591847876.596 PROXY.1055 00021 user 1.112.15.32:54050 69.171.250.13:443 0 0 0 CONNECT connect.facebook.net:443 HTTP/1.1
[11/Jun/2020:06:57:56 +0300] - +_L1591847876.664 PROXY.1055 00011 user 1.112.15.32:54052 178.132.201.52:443 0 0 0 CONNECT cdn.bitrix24.ru:443 HTTP/1.1
[11/Jun/2020:06:57:56 +0300] - +_L1591847876.767 PROXY.1055 00021 user 1.112.15.32:54053 69.171.250.13:443 0 0 0 CONNECT connect.facebook.net:443 HTTP/1.1
[11/Jun/2020:06:57:56 +0300] - +_L1591847876.794 PROXY.1055 00011 user 1.112.15.32:54058 195.201.153.16:443 0 0 0 CONNECT autocomplete.diginetica.net:443 HTTP/1.1
[11/Jun/2020:06:57:56 +0300] - +_L1591847876.845 PROXY.1055 00021 user 1.112.15.32:54057 64.233.164.97:443 0 0 0 CONNECT www.googletagmanager.com:443 HTTP/1.1
[11/Jun/2020:06:57:57 +0300] - +_L1591847877.185 PROXY.1055 00021 user 1.112.15.32:54060 151.236.80.33:443 0 0 0 CONNECT kotly.vseinstrumenti.ru:443 HTTP/1.1
[11/Jun/2020:06:57:57 +0300] - +_L1591847877.345 PROXY.1055 00021 user 1.112.15.32:54061 151.236.80.33:443 0 0 0 CONNECT kotly.vseinstrumenti.ru:443 HTTP/1.1
[11/Jun/2020:06:57:58 +0300] - +_L1591847878.277 PROXY.1055 00021 user 1.112.15.32:54070 172.67.71.84:443 0 0 0 CONNECT cdn.lenmit.com:443 HTTP/1.1
[11/Jun/2020:06:57:58 +0300] - +_L1591847878.281 PROXY.1055 00021 user 1.112.15.32:54071 23.105.254.116:443 0 0 0 CONNECT js.mixmarket.biz:443 HTTP/1.1
[11/Jun/2020:06:57:58 +0300] - +_L1591847878.282 PROXY.1055 00011 user 1.112.15.32:54073 23.105.254.116:443 0 0 0 CONNECT js.mixmarket.biz:443 HTTP/1.1
[11/Jun/2020:06:57:58 +0300] - +_L1591847878.282 PROXY.1055 00011 user 1.112.15.32:54072 172.67.71.84:443 0 0 0 CONNECT cdn.lenmit.com:443 HTTP/1.1
[11/Jun/2020:06:57:58 +0300] - +_L1591847878.359 PROXY.1055 00021 user 1.112.15.32:54074 88.212.201.198:443 0 0 0 CONNECT counter.yadro.ru:443 HTTP/1.1

В это время памяти хватает на сервере. Куда копать?

**Comment by z3APA3A** [comment]
В ulimit'ы например, см.
https://3proxy.ru/highload.asp

**Comment by svist17** [comment]
Подскажите, пожалуйста, как настроить сквозное https прокси для клиентов не поддерживающих прокси? 
DNS резолвит адрес сайта как адрес прокси сервера, но в браузере возникает ошибка ERR_SSL_PROTOCOL_ERROR .

В логах следущее:
`1592078556.785 PROXY.443 00512 - <ClientIP>:53715 0.0.0.0:0 0 0 0 ____`

Для http данная схема работает без проблем.

**Comment by ezbik** [comment]
>как настроить сквозное https прокси

tcppm ...
parent ...

и NAT-ить трафик на порт tcppm.

**Comment by jokedroid** [comment]
> Подскажите, пожалуйста, как настроить сквозное https прокси для клиентов не поддерживающих прокси?
> 
> Прокси опубликован по портам 80 и 443.
> 
> ```
> proxy  -p80 -a
> proxy  -p443 -a
> ```
> 
> DNS резолвит адрес сайта как адрес прокси сервера, но в браузере возникает ошибка ERR_SSL_PROTOCOL_ERROR .
> 
> В логах следущее:
> `1592078556.785 PROXY.443 00512 - <ClientIP>:53715 0.0.0.0:0 0 0 0 ____`
> 
> Для http данная схема работает без проблем.

   Рекомендую статью [Основы прозрачного проксирования с использованием 3proxy и iptables/netfilter или как «пустить всё через прокси»](https://habr.com/ru/post/460469/)
   Есть в ней недостатки, но описано всё, что Вам необходимо.

**Comment by ezbik** [comment]
Планируется ли добавить обработку TLS SNI при нахождении соответствия в ACL <targetlist>?
Было бы удобно роутить определенный HTTPS трафик -- либо локально, либо на parent proxy.

**Comment by z3APA3A** [comment]
Планируется с допилками SSL-плагина, но лучше не закладываться на этот способ, т.к. в TLS 1.3 уже есть расширения позволяющие передавать SNI шифрованно и с большой вероятностью он перестанет работать в будущем.

**Comment by upanasiuk** [comment]
Есть конфиг, основная часть: 
```users user_one:CL:pass
users user_two:CL:pass

internal 127.0.0.1
auth none
socks -p10802 -Deenp2s0
socks -p10803 -Deppp0

internal 192.168.22.1
auth useronly
flush
allow inet2
parent 1000 socks5 127.0.0.1 10802
allow inet3
parent 1000 socks5 127.0.0.1 10803
socks -p1080 -Diwg0```

Возможно ли реализовать тоже самое, но более "красиво"?

**Comment by z3APA3A** [comment]
Правильно - задать source routing в системе и биндить по IP а не интерфейсам в прокси, тогда можно использовать parent extip.

**Comment by constantineav** [comment]
Добрый день.
Не могу понять как настроить бэкконект если несколько интерфейсов в системе.
Например есть такие интерфейсы
eth0 192.168.100.140 
eth1 192.168.50.3

Конфиг
socks -rmypublickserver.io:5650 -Deeth1 -Dieth1 -i192.168.50.3 -e192.168.50.3

в tcpdump вижу что коннект к внешнему серверу идет через eth0
```tcpdump: verbose output suppressed, use -v or -vv for full protocol decode
listening on any, link-type LINUX_SLL (Linux cooked), capture size 262144 bytes
07:08:09.790402 IP 192.168.100.140.41540 > 1.1.1.1.5650: Flags [S], seq 841106743, win 64240, options [mss 1460,sackOK,TS val 166656503 ecr 0,nop,wscale 7], length 0
07:08:09.837630 IP 1.1.1.1.5650 > 192.168.100.140.41540: Flags [S.], seq 159672562, ack 841106744, win 65160, options [mss 1460,sackOK,TS val 3676889618 ecr 166656503,nop,wscale 7], length 0
07:08:09.837664 IP 192.168.100.140.41540 > 1.1.1.1.5650: Flags [.], ack 1, win 502, options [nop,nop,TS val 166656550 ecr 3676889618], length 0
07:08:09.897827 IP 192.168.100.140.41540 > 1.1.1.1.5650: Flags [F.], seq 1, ack 1, win 502, options [nop,nop,TS val 166656610 ecr 3676889618], length 0

```

Подскажите, как правильно это решать?

**Comment by z3APA3A** [comment]
-De и -e влияют на исходящие запросы в сторону конечного сервера и не влияют на реверс-коннекты, для них лучше прописать маршруты на уровне системы.

**Comment by n-prizrak** [comment]
FreeBSD 13.0, ставил и из портов, и из pgk (все обновлено)
в доументации написано использовать TransparentPlugin.ld.so
Но такого плагина нету.

**Comment by z3APA3A** [comment]
Я не в курсе какая версия 3proxy в пакаджах FreeBSD 13. Старые версии поддерживали только Linux. Текущая версия  TransparentPlugin из devel должна работать в FreeBSD, собери 3proxy из сорсов.

**Comment by n-prizrak** [comment]
3proxy-0.8.13
 Да, уже увидел. Спасибо

**Comment by gasl20** [comment]
Владимир, подскажите пожалуйста
https://github.com/z3APA3A/3proxy/issues/468#issuecomment-640554023

**Comment by ezbik** [comment]
> Владимир, подскажите пожалуйста
> [#468 (comment)](https://github.com/z3APA3A/3proxy/issues/468#issuecomment-640554023)

так конфиги разные, это ничего?

> окно авторизации не появляется.

Выше писали, firefox не умеет socks auth. Только http auth.
Тестируйте с помощью curl.

**Comment by ezbik** [comment]
Можно ли смотреть счетчики  в live-режиме? Они в файле counter, или кэшируются в памяти?
сейчас использую хак -- получаю их через админ-гуи, соответственно там links (он нормально показывает html таблицы) + sed + awk, плюс лишний порт в 3proxy.

**Comment by z3APA3A** [comment]
Счетчики в файле обновляют примерно раз в минуту, формат файла такой:
```
struct counter_header cheader = {"3CF", (time_t)0};
struct counter_record {
	uint64_t traf64;
	time_t cleared;
	time_t updated;
};

```

**Comment by ticolensic** [comment]
Привет. Скачиваю с сайта стабильную версию (за 2019 год) через последний firefox, он ругается на вредоносный контент (32&64 бита). С devel версией все норм.
Не уверен, как он это делает (возможно, просто по ссылке).

**Comment by z3APA3A** [comment]
Привет, зарепорти это производителям антивируса пожалуйста. К сожалению, код 3proxy часто встраивают в мелварь, а производители антивируса без разбора используют фрагменты кода для сигнатур.

**Comment by 6zxa9** [comment]
Привет. Есть задача жестко задать количество одновременных подключений.
Есть такой конфиг:
```
monitor /usr/local/3proxy/3proxy13.cfg

daemon
timeouts 1 5 30 60 180 1800 15 60
maxconn 5000
nserver 192.168.88.213
nscache 65535
log /dev/null
auth iponly strong
users test1:CL:test1 test2:CL:test2 test3:CL:test3  
deny test1,test2,test3 * $/usr/local/3proxy/ban.list * * *
allow test1,test2,test3 * * * * * *
allow * 192.168.88.100 * * * * * 
connlim 150 0 test1 * * * *
connlim 100 0 test2 * * * *
connlim 150 0 test3 * * * *
proxy -n -a -p7013 -i192.168.88.100 -e192.168.88.113
socks -n -a -p8013 -i192.168.88.100 -e192.168.88.113
flush
```


В конфиге  не работает ограничение на количество подключений (connlim). Смотрю количество подключений командами

```
netstat -nput | awk '{print $4}'|awk -F: '{print $2}' | sort -rn | uniq -c | sort -nr | less
netstat -na |grep 7013  | awk '{print $5}' | awk -F: '{print $1}' | sort -rn | uniq -c | sort -rn | less
```


Подскажите как сделать так чтобы ограничение работало ? Версия 3proxy devel

**Comment by z3APA3A** [comment]
Отфильтруй только established-соединения и уточни что именно ты видишь.

**Comment by ezbik** [comment]
Появится ли опция маркировать fwmark исходящие соединения? Например для каждого блока acl задать fwmark. Чтоб маркировать коннект на соответствующий parent или прямое исходящее соединение.

**Comment by z3APA3A** [comment]
Если ты имеешь ввиду поддержать SO_MARK для сокета - поставь фичреквест.

**Comment by ezbik** [comment]
Да, это оно.

SO_MARK (since Linux 2.6.25)
              Set the mark for each packet sent through this socket (similar
              to the netfilter MARK target but socket-based).  Changing the
              mark can be used for mark-based routing without netfilter or
              for packet filtering.  Setting this option requires the
              CAP_NET_ADMIN capability.

**Comment by drequivalent** [comment]
Приветствую!

Есть у нас пользователь harry, а еще у него есть IP 192.248.168.139, который должен пропускать без пароля.

Этому пользоватедю надо разрешить, скажем, ifconfig.co и запретить все остальное.

```
users harry:CL:Aeph9Cohge3ra
auth iponly strong
allow harry
allow * 192.248.168.139
allow * * ifconfig.co
deny *
```

Такая конфигурация - не работает. Скажи, Зараза, что я делаю не так?

**Comment by tango-debug** [comment]
Помогите решить проблему. Под Windows Proxy работает хорошо, а под Linux нет

Конфиг:
auth none
log
proxy -n -a -p8001 -i192.168.78.6 -e192.168.8.100
proxy -n -a -p8001 -i192.168.78.6 -e192.168.9.100

Лог:
200802122224.430 8001 00000 - 192.168.78.6:8001 192.168.8.100:0 0 0 0 Accepting connections [4418/1440663296]
200802122224.431 8002 00000 - 192.168.78.6:8002 192.168.9.100:0 0 0 0 Accepting connections [4418/1440593664]
200802122240.801 8002 00013 - 192.168.78.8:55719 178.62.9.171:443 0 0 0 CONNECT myip.ru:443 HTTP/1.1
200802122240.802 8002 00013 - 192.168.78.8:55721 209.85.233.155:443 0 0 0 CONNECT adservice.google.com:443 HTTP/1.1
200802122240.804 8002 00013 - 192.168.78.8:55722 64.233.165.156:443 0 0 0 CONNECT adservice.google.ru:443 HTTP/1.1
200802122240.809 8002 00013 - 192.168.78.8:55720 178.62.9.171:443 0 0 0 CONNECT myip.ru:443 HTTP/1.1
200802122240.817 8002 00013 - 192.168.78.8:55723 64.233.163.95:443 0 0 0 CONNECT ajax.googleapis.com:443 HTTP/1.1
200802122249.083 8002 00013 - 192.168.78.8:55724 185.26.182.94:443 0 0 0 CONNECT speeddials.opera.com:443 HTTP/1.1
200802122255.502 8002 00013 - 192.168.78.8:55725 82.145.217.121:443 0 0 0 CONNECT desktop-dna.osp.opera.software:443 HTTP/1.1
200802122352.320 8002 00013 - 192.168.78.8:55727 87.250.250.33:443 0 0 0 CONNECT soft.export.yandex.ru:443 HTTP/1.0
200802122352.321 8002 00013 - 192.168.78.8:55726 77.88.55.70:443 0 0 0 CONNECT yandex.ru:443 HTTP/1.0
200802122352.352 8002 00013 - 192.168.78.8:55728 213.180.193.234:443 0 0 0 CONNECT sec.api.browser.yandex.ru:443 HTTP/1.0
200802122352.352 8002 00013 - 192.168.78.8:55729 213.180.193.14:80 0 0 0 POST http://clck.yandex.ru/click/dtype=elduse/product=ystroka/path=batch/ HTTP/1.1
200802122421.895 8002 00013 - 192.168.78.8:55730 185.26.182.112:443 0 0 0 CONNECT merchandise.opera-api.com:443 HTTP/1.1
200802122443.888 8002 00013 - 192.168.78.8:55731 185.26.182.112:443 0 0 0 CONNECT merchandise.opera-api.com:443 HTTP/1.1
200802122512.861 8002 00013 - 192.168.78.8:55732 95.101.95.43:80 0 0 0 GET http://tile-service.weather.microsoft.com/ru-RU/livetile/preinstall?region=RU&appid=C98EA5B0842DBB9405BBF071E1DA76512D21FE36&FORM=Threshold HTTP/1.1

результат:
Не удается получить доступ к сайту
Веб-страница по адресу https://myip.ru/, возможно, временно недоступна или постоянно перемещена по новому адресу.

ERR_TUNNEL_CONNECTION_FAILED

**Comment by z3APA3A** [comment]
@drequivalent 
правила применяются последовательно. allow harry требует чтобы пользователь был авторизован, поэтому запрашивается авторизация. Поставь правила по ip до правил по имени пользователей

**Comment by z3APA3A** [comment]
@tango-debug 

А что говорит 
telnet -b 192.168.9.100 178.62.9.171 443
на машине где стоит 3proxy?

**Comment by tango-debug** [comment]
root@raspberrypi:/home/pi# telnet -b 192.168.8.100 178.62.9.171 443
Trying 178.62.9.171...
И тихо...

**Comment by z3APA3A** [comment]
Значит проблемы не с прокси, а с настройками сети или роутингом.

**Comment by drequivalent** [comment]
> @drequivalent
> правила применяются последовательно. allow harry требует чтобы пользователь был авторизован, поэтому запрашивается авторизация. Поставь правила по ip до правил по имени пользователей

Это не помогает, все равно есть доступ ко всем сайтам.

**Comment by drequivalent** [comment]
Пробовал вот так:
```
users harry:CL:Aeph9Cohge3ra
auth iponly strong
allow harry * ifconfig.co
allow * 192.248.168.139 ifconfig.co
deny * 
```
Так доступа нет вообще ни к чему.

**Comment by tango-debug** [comment]
> Значит проблемы не с прокси, а с настройками сети или роутингом.

Большое спасибо что указал проблему!
Всё решилось полным уродом от DHCP на статику.

**Comment by ezbik** [comment]
написали же, acl с IP подвинь наверх.

> Так доступа нет вообще ни к чему.

**Comment by drequivalent** [comment]
@ezbik моя проблема не в том, что он спрашивает или не спрашивает пароль. Текущая конфигурация авторизации меня полностью устраивает.

Моя проблема в том, чтобы запретить вообще всем доступ через этот прокси вообще ко всему, кроме ifcofig.co.

Или я что-то не понимаю?

**Comment by ezbik** [comment]
> Ладно, опишу так:
> Прокси должен работать, при условии если: пользователь harry авторизован ИЛИ запрос идет с IP 192.248.168.139 И **место назначения - ifconfig.co**, и ни при каких других.

Аааа, ну теперь-то понятно. 2 строчки тебе помогут 
1. Разрешить этот сайт клиенту с того ip
2. Разрешить этот сайт юзеру harry

**Comment by drequivalent** [comment]
И что же это за строчки?
Вот это
```
allow harry * ifconfig.co
allow * 192.248.168.139 ifconfig.co
```
закрывает в итоге доступ вообще ко всему.

**Comment by z3APA3A** [comment]
>Прокси должен работать, при условии если: пользователь harry авторизован ИЛИ запрос идет с IP 192.248.168.139 И место назначения - ifconfig.co

что непонятного в том, что правила по ip должны идти до правил по имени пользвоателя и что мешает записать в виде правил ровно то, что тебе требуется?

```
allow * 192.248.168.139 ifconfig.co
allow harry 
```

**Comment by drequivalent** [comment]
Хм. Ок, сейчас попробуем

**Comment by drequivalent** [comment]
Не работает. Все равно пропускает пользователя harry везде.

**Comment by z3APA3A** [comment]
А ты и написал что пользователя харри надо пускать везде

**Comment by drequivalent** [comment]
Нет. Я написал, что надо пропускать их обоих на ifconfig.co, и больше никуда.

**Comment by z3APA3A** [comment]
в логических высказываниях приоритет И выше чем ИЛИ (как у умножения и сложения в арифметических), используй их правильно или в скобочках. Твоя задача был эквивалентна 

(пользователь harry авторизован) ИЛИ (запрос идет с IP 192.248.168.139 И место назначения - ifconfig.co)

добавь ifconfig.co в правило с гарри, чтобы ограничить его этим ресурсом.

**Comment by drequivalent** [comment]
Вот так?
```
users harry:CL:Aeph9Cohge3ra
auth iponly strong
allow * 192.248.168.139 ifconfig.co
allow harry * ifconfig.co
deny *
```
Так он тоже никого не пропускает никуда:

```
$ curl -x http://harry:Aeph9Cohge3ra@192.248.168.139:7012 ifconfig.co
<html><head><title>403 Access Denied</title></head>
<body><h2>403 Access Denied</h2><h3>Access control list denies you to access this resource</body></html>
```

**Comment by ezbik** [comment]
Строка с айпи первая должна быть

**Comment by drequivalent** [comment]
@ezbik Уже сделал, смотри предыдущий коммент

**Comment by z3APA3A** [comment]
прокси рестартовл после изменений? Что полностью в конфиге?

**Comment by drequivalent** [comment]
> прокси рестартовл после изменений

Естественно.

Полностью конфиг:
```
root@proxytest:~# cat /etc/3proxy/harry.cfg  
users harry:CL:Aeph9Cohge3ra
auth iponly strong
allow * 192.248.168.139 ifconfig.co
allow harry * ifconfig.co
deny *
proxy -6 -p7000 -i192.248.168.139 -e2001:19f0:7402:1216:3ffc:4028:5e0a:2f72
proxy -6 -p7001 -i192.248.168.139 -e2001:19f0:7402:1216:13d4:6ba3:223d:c5da
proxy -6 -p7002 -i192.248.168.139 -e2001:19f0:7402:1216:5ede:313d:2887:7ae1
proxy -6 -p7003 -i192.248.168.139 -e2001:19f0:7402:1216:7df9:204b:4af9:0986
proxy -6 -p7004 -i192.248.168.139 -e2001:19f0:7402:1216:cd5c:38b7:8040:8928
proxy -6 -p7005 -i192.248.168.139 -e2001:19f0:7402:1216:8228:3891:a71f:4d46
proxy -6 -p7006 -i192.248.168.139 -e2001:19f0:7402:1216:48fc:66e3:893c:79a7
proxy -6 -p7007 -i192.248.168.139 -e2001:19f0:7402:1216:d700:e687:e146:1e8b
proxy -6 -p7008 -i192.248.168.139 -e2001:19f0:7402:1216:c5cf:747b:7c2d:7590
proxy -6 -p7009 -i192.248.168.139 -e2001:19f0:7402:1216:2ea7:eac3:310a:7719
proxy -6 -p7010 -i192.248.168.139 -e2001:19f0:7402:1216:0316:9e8c:685d:aebb
proxy -6 -p7011 -i192.248.168.139 -e2001:19f0:7402:1216:c943:0e09:80a1:4f93
proxy -6 -p7012 -i192.248.168.139 -e2001:19f0:7402:1216:f1aa:4cb0:805f:797c
proxy -6 -p7013 -i192.248.168.139 -e2001:19f0:7402:1216:fa19:dd14:83fc:3c60
proxy -6 -p7014 -i192.248.168.139 -e2001:19f0:7402:1216:8d54:31c0:2e83:8667
proxy -6 -p7015 -i192.248.168.139 -e2001:19f0:7402:1216:8fd5:3d74:056e:4b64
proxy -6 -p7016 -i192.248.168.139 -e2001:19f0:7402:1216:52e8:cb9b:2510:97d8
proxy -6 -p7017 -i192.248.168.139 -e2001:19f0:7402:1216:0d19:71a4:f431:55ff
proxy -6 -p7018 -i192.248.168.139 -e2001:19f0:7402:1216:cb43:6a2a:ed10:040b
proxy -6 -p7019 -i192.248.168.139 -e2001:19f0:7402:1216:ab9d:4c0b:e11d:0670
flush
```

**Comment by z3APA3A** [comment]
Убери
deny *
в конце

**Comment by drequivalent** [comment]
Вот теперь он стал запрашивать авторизацию, хотя авторизация в запрсе есть
```
$ curl -x http://harry:Aeph9Cohge3ra@192.248.168.139:7012 ifconfig.co
<html><head><title>407 Proxy Authentication Required</title></head>
<body><h2>407 Proxy Authentication Required</h2><h3>Access to requested resource disallowed by administrator or you need valid username/password to use this resource</h3></body></html>
```

**Comment by ezbik** [comment]
curl -x  proxyhost:proxyport -U harry:pw ifconfig.co -v

**Comment by z3APA3A** [comment]
Да, тут очнь похоже что имя пользователя у тебя прилетает без пароля.

**Comment by drequivalent** [comment]
Не может такого быть.

Вот конфа без ограничения:
```
users harry:CL:Aeph9Cohge3ra
auth iponly strong
allow * 192.248.168.139
allow harry *
```
И если она работает как надо:
```
[drq@drq-pc ~]$ curl -x http://harry:Aeph9Cohge3ra@192.248.168.139:7012 ifconfig.co
2001:19f0:7402:1216:f1aa:4cb0:805f:797c
[drq@drq-pc ~]$ curl -x http://harry@192.248.168.139:7012 ifconfig.co
<html><head><title>407 Proxy Authentication Required</title></head>
<body><h2>407 Proxy Authentication Required</h2><h3>Access to requested resource disallowed by administrator or you need valid username/password to use this resource</h3></body></html>
```

**Comment by z3APA3A** [comment]
какая версия 3proxy используется?

**Comment by drequivalent** [comment]
Свежесобранная из гита

**Comment by ezbik** [comment]
> Свежесобранная из гита

подтверждаю, у меня тоже выдает 407 на таком конфиге, свежая из git. Причем с вероятностью 50%! Подозреваю, что это потому что ifconfig.co резолвится в 2 IP. Если они совпадают, то получаем http 200, если нет, то 407.

0.8.13 хорошо работает.

**Comment by drequivalent** [comment]
Собрал 0.8.13 из гита.

И внезапно, все конфиг заработал как надо

```
[drq@drq-pc ~]$ curl -x http://harry:Aeph9Cohge3ra@192.248.168.139:7012 ifconfig.co
2001:19f0:7402:1216:f1aa:4cb0:805f:797c
[drq@drq-pc ~]$ curl -x http://harry:Aeph9Cohge3ra@192.248.168.139:7012 google.com
<html><head><title>403 Access Denied</title></head>
<body><h2>403 Access Denied</h2><h3>Access control list denies you to access this resource</body></html>
```

Регрессия, однако, товарищ Зараза.

**Comment by z3APA3A** [comment]
Да, баг плавающий, должен пофикситься с https://github.com/z3APA3A/3proxy/commit/c30b4637a525bf8332b3a9358b51fe0e6973760b

**Comment by ahammers88** [comment]
Всем привет!
Имеется компьютер с двумя подключениями:

    192.168.0.100 (ip от роутера, выход в интернет)
    192.168.100.48 (vpn)

Подскажите пожалуйста, как сделать так, что бы 3proxy раздавал интернет только с VPN, так что бы несколько компьютеров в моей локальной сети могли через прокси пользоваться VPN.

**Comment by merlinjk** [comment]
hi how can i limit the bandwitch on upload for each port ? ( i use tcpmm )

**Comment by z3APA3A** [comment]
@merlinjk
use 'bandlimout'

**Comment by ezbik** [comment]
Когда достигнут лимит соединений   maxconn, то каждое новое соединение ждёт очень долго прежде чем завершиться. Как его отваливать быстрее?

**Comment by z3APA3A** [comment]
@ezbik - параметра конфигурации нет, можно поменять эту строчку 

` 		if(so._listen (sock, 1 + (srv.maxchild>>4))==-1) {
`

в proxymain.c, во втором параметра поставить небольшую константу (1-2-3). Либо можно ее же засунуть в net.core.somaxconn (но не уверен что не будет других побочых эффектов). Для понимания можно почитать про работу backlog соединений, например https://topic.alibabacloud.com/a/the-difference-between-the-font-colorredlinuxfont-kernel-tuning-tcp_max_syn_backlog-and-font-colorredsomaxconnfont_1_16_30138887.html

**Comment by OSadovy** [comment]
3proxy собранный из мастера. пытаюсь настроить back connect по документации из howto, и не выходит.

конфигурация на сервере:
```
log
auth iponly
allow *
tcppm -R0.0.0.0:21000 1080 0.0.0.0 1080
```

конфигурация на клиенте:
```
log
auth iponly
allow *
socks -rSERVERHOST:21000
```

на сервере делаю запрос вида
```
$ curl -vv -x socks5h://localhost:1080 https://api.ipify.org
*   Trying ::1:1080...
* TCP_NODELAY set
* connect to ::1 port 1080 failed: Connection refused
*   Trying 127.0.0.1:1080...
* TCP_NODELAY set
* SOCKS5 communication to api.ipify.org:443
* Unable to receive initial SOCKS5 response.
* Closing connection 0
curl: (7) Unable to receive initial SOCKS5 response.
```

в логах клиента пусто, в логах сервера появляется:
```
200930170433.488 1080 00000 - 0.0.0.0:1080 0.0.0.0:0 0 0 0 Accepting connections [20553/3075716864]
200930170438.203 1080 00000 - 127.0.0.1:52600 CLIENTIP:57712 0 0 0 0.0.0.0
```

**Comment by merlinjk** [comment]
hi is it possible to start service on specific interface eg eth0 
like proxy -a -p8080 -ieth0 -eeth0

**Comment by z3APA3A** [comment]
For devel version check -Di / -De options in https://3proxy.ru/doc/man3/3proxy.cfg.3.html

**Comment by merlinjk** [comment]
okay thanks because i have 140ip on my proxy server and some don't work i don't know why and i want to try this ^^

**Comment by merlinjk** [comment]
all ip work if i make a ping -I X.X.X.X 8.8.8.8 but proxy don't work and there are configurated on 3proxy

**Comment by merlinjk** [comment]
it don't work too with -Di / -De

**Comment by merlinjk** [comment]
i sent you my .cfg on your email

**Comment by merlinjk** [comment]
all is good now 
i have a question is it possible to change Proxy HTTP to HTTPS into Proxy Https to http , to encrypt the proxy

**Comment by merlinjk** [comment]
and how to manage a proxy when he is daemonize with proxy -d

**Comment by BANNN911** [comment]
Здравствуйте. Начало в логе бить 94ю ошибку.. 
`1601722701.945 PROXY.7001 00093 - 185.139.68.207:64360 69.171.250.63:443 4076 4180 0 CONNECT_i.instagram.com:443_HTTP/1.1
1601722708.015 PROXY.7001 00000 - 185.139.68.207:64362 88.214.97.99:443 643 1346 0 CONNECT_instagram.fplv1-2.fna.fbcdn.net:443_HTTP/1.1
1601722710.528 PROXY.7001 00094 - 185.139.68.207:64328 69.171.250.174:443 1077 35245 0 CONNECT_www.instagram.com:443_HTTP/1.1
1601722710.531 PROXY.7001 00094 - 185.139.68.207:64333 69.171.250.174:443 83035 401809 0 CONNECT_b.i.instagram.com:443_HTTP/1.1
1601722710.532 PROXY.7001 00094 - 185.139.68.207:64361 69.171.250.63:443 13132 25717 0 CONNECT_i.instagram.com:443_HTTP/1.1
1601722710.532 PROXY.7001 00094 - 185.139.68.207:64348 69.171.250.63:443 6672 4907 0 CONNECT_graph.instagram.com:443_HTTP/1.1
1601722725.600 PROXY.7001 00000 - 185.139.68.207:64326 69.171.250.174:443 1077 35256 0 CONNECT_www.instagram.com:443_HTTP/1.1
1601722725.677 PROXY.7001 00000 - 185.139.68.207:64330 69.171.250.174:443 1077 35242 0 CONNECT_www.instagram.com:443_HTTP/1.1
1601722725.678 PROXY.7001 00000 - 185.139.68.207:64331 69.171.250.174:443 1077 35277 0 CONNECT_www.instagram.com:443_HTTP/1.1
1601722738.414 PROXY.7001 00000 - 185.139.68.207:64341 69.171.250.63:443 80220 366522 0 CONNECT_i.instagram.com:443_HTTP/1.1
1601722738.551 PROXY.7001 00000 - 185.139.68.207:64343 69.171.250.63:443 94203 372249 0 CONNECT_i.instagram.com:443_HTTP/1.1
1601722738.646 PROXY.7001 00000 - 185.139.68.207:64339 69.171.250.63:443 84894 362350 0 CONNECT_i.instagram.com:443_HTTP/1.1
1601722741.841 PROXY.7001 00000 - 185.139.68.207:64367 88.214.97.99:443 643 1346 0 CONNECT_instagram.fplv1-2.fna.fbcdn.net:443_HTTP/1.1
1601722745.004 PROXY.7001 00000 - 185.139.68.207:64369 88.214.97.99:443 643 1346 0 CONNECT_instagram.fplv1-2.fna.fbcdn.net:443_HTTP/1.1
1601722745.224 PROXY.7001 00000 - 185.139.68.207:64370 88.214.97.99:443 643 1346 0 CONNECT_instagram.fplv1-2.fna.fbcdn.net:443_HTTP/1.1
1601722750.998 PROXY.7001 00094 - 185.139.68.207:64332 69.171.250.174:443 83021 566359 0 CONNECT_b.i.instagram.com:443_HTTP/1.1
1601722751.000 PROXY.7001 00094 - 185.139.68.207:64349 69.171.250.63:443 6670 4907 0 CONNECT_graph.instagram.com:443_HTTP/1.1
1601722751.002 PROXY.7001 00094 - 185.139.68.207:64366 69.171.250.63:443 16942 33739 0 CONNECT_i.instagram.com:443_HTTP/1.1
1601722751.028 PROXY.7001 00094 - 185.139.68.207:64335 69.171.250.174:443 82705 327901 0 CONNECT_b.i.instagram.com:443_HTTP/1.1
1601722751.029 PROXY.7001 00094 - 185.139.68.207:64364 69.171.250.63:443 21629 35972 0 CONNECT_i.instagram.com:443_HTTP/1.1
1601722751.032 PROXY.7001 00094 - 185.139.68.207:64347 69.171.250.63:443 6650 4907 0 CONNECT_graph.instagram.com:443_HTTP/1.1
1601722751.053 PROXY.7001 00094 - 185.139.68.207:64337 69.171.250.174:443 82396 314179 0 CONNECT_b.i.instagram.com:443_HTTP/1.1
1601722751.054 PROXY.7001 00094 - 185.139.68.207:64365 69.171.250.63:443 6218 12119 0 CONNECT_i.instagram.com:443_HTTP/1.1
1601722751.065 PROXY.7001 00094 - 185.139.68.207:64345 69.171.250.63:443 6626 4907 0 CONNECT_graph.instagram.com:443_HTTP/1.1
1601722756.639 PROXY.7002 00094 - 185.244.173.67:50760 69.171.250.174:443 41220 143631 0 CONNECT_b.i.instagram.com:443_HTTP/1.1
1601722756.640 PROXY.7002 00094 - 185.244.173.67:50751 69.171.250.174:443 1077 34961 0 CONNECT_www.instagram.com:443_HTTP/1.1
1601722756.642 PROXY.7002 00094 - 185.244.173.67:50773 69.171.250.63:443 3651 4235 0 CONNECT_graph.instagram.com:443_HTTP/1.1
1601722756.643 PROXY.7002 00094 - 185.244.173.67:50768 69.171.250.63:443 19289 42921 0 CONNECT_i.instagram.com:443_HTTP/1.1
1601722756.715 PROXY.7002 00094 - 185.244.173.67:50757 69.171.250.174:443 41215 152764 0 CONNECT_b.i.instagram.com:443_HTTP/1.1
1601722756.715 PROXY.7002 00094 - 185.244.173.67:50747 69.171.250.174:443 1077 35021 0 CONNECT_www.instagram.com:443_HTTP/1.1
1601722756.715 PROXY.7002 00094 - 185.244.173.67:50779 69.171.250.63:443 3648 4235 0 CONNECT_graph.instagram.com:443_HTTP/1.1
1601722756.719 PROXY.7002 00094 - 185.244.173.67:50770 69.171.250.63:443 33160 89854 0 CONNECT_i.instagram.com:443_HTTP/1.1
1601722756.750 PROXY.7002 00094 - 185.244.173.67:50750 69.171.250.174:443 1077 34982 0 CONNECT_www.instagram.com:443_HTTP/1.1
1601722756.751 PROXY.7002 00094 - 185.244.173.67:50759 69.171.250.174:443 41263 148394 0 CONNECT_b.i.instagram.com:443_HTTP/1.1
1601722756.753 PROXY.7002 00094 - 185.244.173.67:50765 69.171.250.63:443 19228 45957 0 CONNECT_i.instagram.com:443_HTTP/1.1
1601722756.754 PROXY.7002 00094 - 185.244.173.67:50776 69.171.250.63:443 3650 4235 0 CONNECT_graph.instagram.com:443_HTTP/1.1
1601722756.803 PROXY.7002 00094 - 185.244.173.67:50756 69.171.250.174:443 32666 36867 0 CONNECT_b.i.instagram.com:443_HTTP/1.1
1601722756.804 PROXY.7002 00094 - 185.244.173.67:50748 69.171.250.174:443 1077 35013 0 CONNECT_www.instagram.com:443_HTTP/1.1
1601722756.805 PROXY.7002 00094 - 185.244.173.67:50772 69.171.250.63:443 8794 17423 0 CONNECT_i.instagram.com:443_HTTP/1.1
1601722756.830 PROXY.7002 00094 - 185.244.173.67:50762 69.171.250.174:443 41253 92681 0 CONNECT_b.i.instagram.com:443_HTTP/1.1
1601722756.831 PROXY.7002 00094 - 185.244.173.67:50754 69.171.250.174:443 1077 34978 0 CONNECT_www.instagram.com:443_HTTP/1.1
1601722756.831 PROXY.7002 00094 - 185.244.173.67:50774 69.171.250.63:443 3651 4235 0 CONNECT_graph.instagram.com:443_HTTP/1.1
1601722756.832 PROXY.7002 00094 - 185.244.173.67:50769 69.171.250.63:443 49763 91553 0 CONNECT_i.instagram.com:443_HTTP/1.1
1601722756.861 PROXY.7002 00094 - 185.244.173.67:50755 69.171.250.174:443 41381 156600 0 CONNECT_b.i.instagram.com:443_HTTP/1.1
1601722756.862 PROXY.7002 00094 - 185.244.173.67:50746 69.171.250.174:443 1077 35004 0 CONNECT_www.instagram.com:443_HTTP/1.1
1601722756.863 PROXY.7002 00094 - 185.244.173.67:50775 69.171.250.63:443 3662 4235 0 CONNECT_graph.instagram.com:443_HTTP/1.1
1601722756.863 PROXY.7002 00094 - 185.244.173.67:50766 69.171.250.63:443 19402 35950 0 CONNECT_i.instagram.com:443_HTTP/1.1
1601722756.892 PROXY.7002 00094 - 185.244.173.67:50778 69.171.250.63:443 3665 4235 0 CONNECT_graph.instagram.com:443_HTTP/1.1
1601722756.892 PROXY.7002 00094 - 185.244.173.67:50764 69.171.250.63:443 42735 73631 0 CONNECT_i.instagram.com:443_HTTP/1.1
1601722756.893 PROXY.7002 00094 - 185.244.173.67:50749 69.171.250.174:443 1077 35013 0 CONNECT_www.instagram.com:443_HTTP/1.1
1601722756.893 PROXY.7002 00094 - 185.244.173.67:50758 69.171.250.174:443 41402 128975 0 CONNECT_b.i.instagram.com:443_HTTP/1.1
1601722756.919 PROXY.7002 00094 - 185.244.173.67:50763 69.171.250.174:443 40923 154532 0 CONNECT_b.i.instagram.com:443_HTTP/1.1
1601722756.921 PROXY.7002 00094 - 185.244.173.67:50753 69.171.250.174:443 1077 34992 0 CONNECT_www.instagram.com:443_HTTP/1.1
1601722756.922 PROXY.7002 00094 - 185.244.173.67:50771 69.171.250.63:443 19010 41563 0 CONNECT_i.instagram.com:443_HTTP/1.1
1601722756.922 PROXY.7002 00094 - 185.244.173.67:50780 69.171.250.63:443 3627 4235 0 CONNECT_graph.instagram.com:443_HTTP/1.1
1601722756.948 PROXY.7002 00094 - 185.244.173.67:50767 69.171.250.63:443 33258 119914 0 CONNECT_i.instagram.com:443_HTTP/1.1
1601722756.949 PROXY.7002 00094 - 185.244.173.67:50761 69.171.250.174:443 41243 151983 0 CONNECT_b.i.instagram.com:443_HTTP/1.1
1601722756.949 PROXY.7002 00094 - 185.244.173.67:50777 69.171.250.63:443 3652 4235 0 CONNECT_graph.instagram.com:443_HTTP/1.1
1601722756.950 PROXY.7002 00094 - 185.244.173.67:50752 69.171.250.174:443 1077 35038 0 CONNECT_www.instagram.com:443_HTTP/1.1
1601722766.960 PROXY.7002 00094 - 185.244.173.67:50781 79.124.240.33:443 0 0 0 CONNECT_instagram.flwo2-1.fna.fbcdn.net:443_HTTP/1.1`

Как её побороть? в чем причина может быть?

**Comment by z3APA3A** [comment]
94 - "грязное" закрытие соединения со стороны клиента.  Это может быть плохо написаный клиент или пропадает связь между прокси и клиентом.

**Comment by merlinjk** [comment]
is it better 3proxy on linux or Windows because on linux i expect a lot of crash

**Comment by Vision20202** [comment]
Здравствуйте.
В логе часто встречается ошибка 00090, на сайте программы есть описание - socket error or connection broken. Но честно говоря непонятно в чём конкретно ошибка и как исправить. Речь идёт о версии программы под Windows.

**Comment by z3APA3A** [comment]
В последней devel-версии коды ошибок были переписаны и ошибки стандартизованы лучше, см. 
https://3proxy.ru/howtor.asp#ERRORS
в ней 90я ошибка означает сбой вызванный системной ошибкой, она должна появляться крайне редко. Это может быть нехватка памяти, нехватка системных буферов, перезапуск сетевых служб (например при обновлении системы), завершение системы и т.д. из-за которых система прерывает сетевой запрос.

**Comment by ezbik** [comment]
Где-то здесь был вопрос/комментарий, о нужности HTTPS прокси. @z3APA3A предложил использовать TLS прокси -> HTTP. НО при этом теряется возможность ACL по клиентским IP. Ведь для HTTP прокси клиентский IP будет 127.0.0.1.
Так что вопрос остается открытым.

**Comment by z3APA3A** [comment]
stunnel умеет пробрасывать клиентский IP. Я планирую переписать SSLPlugin, и добавитьв т.ч. возможность терминировать TLS на входящем интерфейсе но это точно будет не прямо сейчас, т.к. сейчас меняется архитектура прокси и переписывать плагины до этого не имеет смысла, т.к. потом скорей всего придется переписывать еще раз.

**Comment by Vision20202** [comment]
> 
> 
> В последней devel-версии коды ошибок были переписаны и ошибки стандартизованы лучше, см.
> https://3proxy.ru/howtor.asp#ERRORS
> в текущем devel под windows 90й ошибки вообще не должно происходить, она может возникать только под Linux при использовании splice, скорей всего ты будешь получать более понятный код, который описывает ситуацию.

Спасибо за ответ. Последняя для Windows это 0.9-devel-x64? Это с неё ошибку 90 я и приводил.

**Comment by z3APA3A** [comment]
Последняя devel это с вот этим коммитом https://github.com/z3APA3A/3proxy/commit/eb829b062b7e65093284e0842d4b0792b55f8844
например версия 201012105831, которая сейчас раздается в https://3proxy.ru/download/devel/

**Comment by tern222** [comment]
Здравствуйте. Не могу разобраться с socsk5 - не пускает никуда((( При auth none все работает без проблем.

`daemon

nserver 8.8.8.8
nserver 8.8.4.4
nscache 65536
timeouts 1 5 30 60 180 1800 15 60
maxconn 32

users test:CL:test

log /var/log/3proxy/3proxy.log D
logformat "L%C - %U [%d/%m/%Y:%H:%M:%S %z] ""%T"" %E %I %O %N/%R:%r"
rotate 30

# HTTP
allow * * yandex.ru
deny * * 127.0.0.1,192.168.1.1
deny *
proxy -p10601 -n -a

flush

# SOCKS
auth strong
allow test
socks -p10602 -n -a -u2
`

**Comment by Vision20202** [comment]
> 
> 
> Последняя devel это с вот этим коммитом [eb829b0](https://github.com/z3APA3A/3proxy/commit/eb829b062b7e65093284e0842d4b0792b55f8844)
> например версия 201012105831, которая сейчас раздается в https://3proxy.ru/download/devel/
> Посмотреть версию можно через 3proxy --version

Спасибо! Теперь понял. Обновил версию, ошибка 90 видимо ушла, но появилась 95.
14-10-2020 18:40:48 | - | 192.168.1.82:60651 | 209.85.233.157:443 | 209.85.233.157:443 | 0 | 0 | www.googleadservices.com | CONNECT www.googleadservices.com:443 HTTP/1.1 | 00095
95 - таймаут из-за ограничения bandlimin/bandlimout 

И вот здесь самое интересное, в конфиге то нет ограничений... Где копать источник проблемы?

**Comment by z3APA3A** [comment]
Это вы смотрите в старый HowTo. В новой версии
95 - клиент "грязно" закрыл соединение или сетевая ошибка 
такое может если "убить" процесс браузера с установленными соединениями (так тобы он не закрыл сокет) ну или просто из-за плохо написаного клиента.

**Comment by sergey-zabolotny** [comment]
добрый вечер! подскажите как правильно настроить браузер на использование прокси с включенной auth strong?
прописываю прокси в конфигурации браузера, при первой попытке открыть любой ресурс через прокси просит пароль, вводим, а дальше сплошные ошибки типа `The proxy server is refusing connections
Firefox is configured to use a proxy server that is refusing connections.
    Check the proxy settings to make sure that they are correct.
    Contact your network administrator to make sure the proxy server is working.`

**Comment by z3APA3A** [comment]
Эта ошибка означает что прокси недоступен из внешних сетей. Версия 0.6.1 очень давно устарела, в настоящий момент готовится релиз 0.9 и заканчивается поддержка 0.8. Я не уверен что в 0.6 был auth cache.

**Comment by sergey-zabolotny** [comment]
если убрать auth cache ситуация не меняется, но auth cache работает, т.к. при первой аутентификации последющие запросы без логина/пароля отрабатываются. т.е. достаточно выполнить курл комманду, которую я указал выше, и после этого в браузере с того же айпи прокси начинает работать. если бы прокси небыл доступен из внешних сетей я бы получал таймаут и в логах прокси не видел бы записи о запросах из браузера, но в логах записи есть. обновить версию прокси на данный момент не прдеставляется возможным.

**Comment by z3APA3A** [comment]
Если ты видишь запрос в логах сервера - там есть код ошибки. Если ты не видишь запрос в логах сервера - значит до сервера он не дошел. В остальном, к сожалению, ты сам по себе, т.к. версия 6.1 выпущена более 10 лет назад и никто с ней разбираться не будет.

**Comment by sergey-zabolotny** [comment]
собрал девел из исходников, проблема порешалась. спасибо за помощь

**Comment by merlinjk** [comment]
Hi is it possible to convert https proxy to socks5 proxy with 3proxy ?

**Comment by z3APA3A** [comment]
yes, it's possible, see 'parent' command.

**Comment by Vision20202** [comment]
> Последняя devel это с вот этим коммитом [eb829b0](https://github.com/z3APA3A/3proxy/commit/eb829b062b7e65093284e0842d4b0792b55f8844)

И снова здравствуйте! :) Очень сомневаюсь, что Вы сможете помочь, но вдруг. Ситуация. Через 3proxy реализована работа мобильных прокси, т.е. используются 4G модемы. В этой системе надо менять IP с определенным промежутком времени. Меняет IP одна программа, которая как-то обращается к модему и делает смены режима работы с 4G на 3G и потом обратно на 4G. А теперь суть проблемы.
Если прокси подняты на виртуальной машине и программа для смены IP запущена на хосте под Win, то всё работает идеально. Если же прокси подняты на Win, то программа для смены IP безумно начинает потреблять память, 5 Гб ОЗУ за пару дней набирает.
Я думал это глюк самой программы, пока не поставил devil версию и тут потребление программы резко упало. Больше 80 Мб ОЗУ она не берет. Понимаю, что звучит безумно, но факт в том, что от версии 3proxy как-то связано потребление ОЗУ программой для смены IP и вот еще одно подтверждение. Я было уже начал радоваться, что решилась давняя проблема, но обнаружилась другая. На devil версии  [eb829b0] некоторые модемы перестали переключаться в режим 4G, т.е. путь 4G --> 3G --> 4G стал ломаться. Откатил к версии 3proxy-0.8.13 (190801174904) и эта проблема ушла, но жор памяти возобновился.
В общем как-то это всё связано с 3proxy, а каким образом - не понимаю. Какие-то запросы от программы к модему не проходят (программа подключается через соответствующий прокси к каждому модему). 
Понимаю, что едва ли дал Вам полезную информацию, но вдруг... Порой самые мутные отзывы бывают полезными. :)

**Comment by z3APA3A** [comment]
3proxy работает на прикладном уровне и не может влиять на другие процессы и оборудование. Изменение поведения программы не может быть связано с изменением версии 3proxy

**Comment by z3APA3A** [comment]
Но в этом коммите 3proxy может быть проблема, которая приводит к зацикливанию и высокому потребления процессора (правда на Windows она не должна проявляться), лучще обновиться до текущего devel, где эта проблема устранена.

**Comment by Vision20202** [comment]
Текущий devel когда появился, какого числа? Влиять на другие программы напрямую не может, но если есть какие-то проблемы с прохождением трафика, то вполне себе может влиять. Я не могу иначе объяснить, почему на 8-й версии потребление памяти гигантское, а на 9-й - почти на два порядка меньше. Причем я тестировал несколько раз. Меняешь версию программы и проблема воспроизводится.

**Comment by TaciturnShadow** [comment]
Раньше (0.8.13) в дистрибутиве был rus.3ps, а теперь (0.9.0) его там нет. Можно ли использовать https://github.com/z3APA3A/3proxy/blob/devel/rus.3ps?

**Comment by z3APA3A** [comment]
Файл есть, лежит в корне дистрибутива.

**Comment by zebop117** [comment]
Возвращает 400 Bad Request для не-CONNECT https запросов (т.е. GET https://..., POST https://..., и т.п.). Не CONNECT, потому что пытаюсь продлить жизнь старой проге, которая не умеет ни TLS 1.3, ни SNI.

Винда 7 SP 1 x64, 3proxy 0.9.0 x64 (та же история и с версией 0.8.13 x64), OpenSSL 1.0.1.7 x64 (в system32, но также пробовал подкладывать файлы libeay32.dll, libssl32.dll, ssleay32.dll в папку с 3proxy.exe).

Конфиг:
<pre>
nserver 192.168.1.3
nserver 8.8.8.8
nscache 65536
timeouts 1 5 30 60 180 1800 15 60
log 3proxy.log
logformat "- +_L%t.%.  %N.%p %E %U %C:%c %R:%r %O %I %h %T"
rotate 30
auth iponly
allow * 127.0.0.1,192.168.1.3 * * * * *
#deny *
external 0.0.0.0
internal 0.0.0.0
proxy -p6543 -n -a -46
</pre>

Лог:
<pre>
1603685048.170  PROXY.6543 00000 - 0.0.0.0:6543 0.0.0.0:0 0 0 0 Accepting_connections_[816/3612]
1603685068.590  PROXY.6543 00513 - 127.0.0.1:53372 0.0.0.0:0 0 0 0 GET_https://ya.ru/_HTTP/1.1
</pre>

Ответ (видимо, proxy_stringtable[0]):
<pre>
HTTP/1.0 400 Bad Request
Connection: close
Content-type: text/html; charset=utf-8

&lt;html>&lt;head>&lt;title>400 Bad Request&lt;/title>&lt;/head>
&lt;body>&lt;h2>400 Bad Request&lt;/h2>&lt;/body>&lt;/html>
</pre>

**Comment by z3APA3A** [comment]
GET https://ya.ru/ - такого режима в прокси-серверах не бывает. HTTPS через прокси идет через CONNECT. Кроме http:// может быть только ftp:// (ака FTP over HTTP).

**Comment by fatory** [comment]
Приветствую.
Есть такой конфиг
monitor C:\3proxy\bin64\3proxy.txt
maxconn 1500
timeouts 1 5 30 60 180 1800 15 60
auth strong
users login1:CL:pass1
allow login1
proxy -n -a -p8062 -i192.168.0.100 -e192.168.2.100
proxy -n -a -p8063 -i192.168.0.100 -e192.168.3.100
proxy -n -a -p8064 -i192.168.0.100 -e192.168.4.100

Прокси это 4g модемы.

Если не указывать nserver то в нс передаются все нс т.е от всех 3 прокси +от основного соединения. 8 нс)
Если указать дефолтный шлюз от любого прокси (nserver 192.168.2.1) то от него и будут нс у всех прокси.
Можно ли как то указать  nserver для каждого прокси?
Или как то по другому оформить конфиг что бы каждая прокси получала свой нс сервер?

**Comment by z3APA3A** [comment]
DNS кеш и настройки разрешения имен общие для всех прокси, запусти 3 экземпляра прокси с разными конфигами.

**Comment by fatory** [comment]
C:\3proxy\bin64\3proxy.exe --install C:\3proxy\bin64\3proxy.txt
C:\3proxy\bin64\3proxy.exe --install C:\3proxy\bin64\3proxy2.txt
Вот так можно сделать?)

**Comment by z3APA3A** [comment]
Так - нет, но можно или вручную добавить службы в регистре через sc create или запускать один прокси как службу,  а остальные запускать через system в конфиге.

**Comment by z3APA3A** [comment]
см. команду system в документации. Можно запускать прокси с 3proxy.txt, а из 3proxy.txt запускать остальные прокси.

**Comment by fatory** [comment]
К сожалению не смогу запустить. По отдельности конфиги работает а если запускать так то не запускается .Долго думает а потом ошибка).

monitor C:\3proxy\bin64\3proxy.txt
maxconn 1500
timeouts 1 5 30 60 180 1800 15 60
nserver 192.168.4.1
nscache 65536
auth strong
users login1:CL:pass1
allow login1
proxy -n -a -p8064 -i192.168.0.100 -e192.168.4.100
system "C:\3proxy\bin64\3proxy.exe C:\3proxy\bin64\3proxy1.txt" 

Конфиг 3proxy1.txt

monitor C:\3proxy\bin64\3proxy1.txt
maxconn 1500
timeouts 1 5 30 60 180 1800 15 60
nserver 192.168.3.1
nscache 65536
auth strong
users login1:CL:pass1
allow login1
proxy -n -a -p8063 -i192.168.0.100 -e192.168.3.100

**Comment by z3APA3A** [comment]
добавь daemon в конфиги.

**Comment by Vision20202** [comment]
Ого, какая интересная тема поднялась.
Т.е. можно вот таким образом
system "C:\3proxy\bin64\3proxy.exe C:\3proxy\bin64\3proxy1.txt"
system "C:\3proxy\bin64\3proxy.exe C:\3proxy\bin64\3proxy2.txt"
system "C:\3proxy\bin64\3proxy.exe C:\3proxy\bin64\3proxy3.txt"
подключать сколько угодно прокси со своими индивидуальным настройками, в первую очередь ДНС? И корректный пример такого файла 3proxy1.txt

> monitor C:\3proxy\bin64\3proxy1.txt
> daemon 3proxy конфигурация
> maxconn 1500
> timeouts 1 5 30 60 180 1800 15 60
> nserver 192.168.3.1
> nscache 65536
> auth strong
> users login1:CL:pass1
> allow login1
> proxy -n -a -p8063 -i192.168.0.100 -e192.168.3.100

Всё верно? Это начиная с какой версии работает и windows/linux - не важно?

**Comment by fatory** [comment]
Не запускается(

daemon
monitor C:\3proxy\bin64\3proxy.txt
maxconn 1500
timeouts 1 5 30 60 180 1800 15 60
nserver 192.168.4.1
auth strong
users login1:CL:pass1
allow login1
proxy -n -a -p8054 -i192.168.0.100 -e192.168.4.100
system "C:\3proxy\bin64\3proxy.exe C:\3proxy\bin64\3proxy1.txt" 

daemon
monitor C:\3proxy\bin64\3proxy1.txt
maxconn 1500
timeouts 1 5 30 60 180 1800 15 60
nserver 192.168.3.1
auth strong
users login1:CL:pass1
allow login1
proxy -n -a -p8053 -i192.168.0.100 -e192.168.3.100

**Comment by z3APA3A** [comment]
@Vision20202 команда system появилась в самых первых версиях

@fatory сделай system "start C:\3proxy\bin64\3proxy.exe C:\3proxy\bin64\3proxy1.txt"

**Comment by SasZt** [comment]
в последней версии под Windows, сломалась такая конструкция:
`allow * * $"c:\3proxy\bin\prefixes" * * * *
parent 1000 socks5 94.242.59.92 1488`

файл содержит список ИП адресов
`93.186.225.202,93.186.225.200,93.186.225.201`

в версии от 07.10.20 все работает нормально, в текущей просто игнорируется сокс и соединение идет напрямую.

**Comment by z3APA3A** [comment]
@SasZt поправил в devel

**Comment by codeman-777** [comment]
Не пинайте сильно новичка.
Что установить на распбери 4, чтобы поднять на нем 3 мобильные прокси на e3372? Ubuntu server?

**Comment by Vision20202** [comment]
Этот вопрос вообще левый касательно 3proxy. Зачем засорять ветку тем, что никакого отношения не имеет к обсуждаемому софту.

**Comment by Postpuber** [comment]
Поставил на Ubuntu 20.04 стабильную версию 0.9.0. Вроде бы работает, но логи не пишутся. Даже файл не создается. Права у папки - 750, пользователь proxy.

Ставил, как рекомендовано в readme:
```
git clone https://github.com/z3apa3a/3proxy
cd 3proxy
ln -s Makefile.Linux Makefile
make
sudo make install
```
Конфиг:

```
nscache 65536
nserver 8.8.8.8
nserver 8.8.4.4

config /conf/3proxy.cfg
monitor /conf/3proxy.cfg

timeouts 1 5 30 60 180 1800 15 60

log /logs/3proxy-%y%m%d.log D
logformat "- +_L%t.%.  %N.%p %E %U %C:%c %R:%r %O %I %h %T"
rotate 60
counter /count/3proxy.3cf

users $/conf/passwd 

include /conf/counters
include /conf/bandlimiters

auth cache strong
allow *
parent 1000 socks5 10.200.200.2 3000 serverLT tae8jEYNysVXRVSHn-fPf-Mr-Q5u3d
proxy -n -p3003 -a

flush
auth cache strong
socks -n -p3000 -a
```

Есть идеи?

**Comment by z3APA3A** [comment]
Если из /etc/3proxy/3proxy.cfg убрать daemon и запустить руками
/bin/3proxy /etc/3proxy/3proxy.cfg
что напишет?

**Comment by z3APA3A** [comment]
И git clone https://github.com/z3apa3a/3proxy это не стабильная версия, это devel. Там могли быть проблемы слоггированием и они могли уже починиться, попробуй заново склонировать и пересобрать.

**Comment by z3APA3A** [comment]
@Postpuber в текущем devel должно работать.
Сейчас в devel активно идет разработка следующей версии и рефакторинг, сделал пока веткой по умолчанию master (stable)/

**Comment by Postpuber** [comment]
@z3APA3A, спасибо. Я вчера скачал stable релиз 0.9.0 и из него собрал. Логи теперь пишутся. Но обраружилась одна странная особенность. При работе через прокси браузер на одном из сайтов обрезает страницы.
Вот пример страницы: https://www.vtimes.io/2020/10/31/snyatsya-li-tsukerbergu-elektroovtsi-a1213
А вот как она выглядит у меня: [скриншот](https://s.2fb.ru/uploads/2020/10/vtimes.jpg).

Страницы образаются только на 0.9.0, которых у меня теперь две - на удаленном VDS и на локальной Raspberry Pi. При этом на 0.8.х такой проблемы нет (их тоже у меня две штуки). Пример используемого конфига 0.9.0 выкладывал выше. Поведение одинаковое как через socks, так и через proxy + parent socks5.

Что-то можно поделать?

**Comment by Vision20202** [comment]
> monitor C:\3proxy\bin64\3proxy.txt

Завис на этом моменте. А что собственно должно содержаться в файле 3proxy.txt

**Comment by Vision20202** [comment]
Подскажите пожалуйста, в чем может быть проблема. Основной конфиг:
```
daemon
monitor C:\3proxy_64\bin64\3proxy.txt

auth none

nserver 77.88.8.8
nserver 77.88.8.1
nscache 65536

logformat "L%d-%m-%Y %H:%M:%S | %U | %C:%c | %R:%r | %Q:%q | %O | %I | %n | %T | %E"
log C:\3proxy_64\log\3proxy.log D
rotate 30

maxconn 1000

system "start C:\3proxy_64\bin64\3proxy.exe C:\3proxy_64\bin64\3proxy_beeline.txt"
system "start C:\3proxy_64\bin64\3proxy.exe C:\3proxy_64\bin64\3proxy_megafon.txt"
system "start C:\3proxy_64\bin64\3proxy.exe C:\3proxy_64\bin64\3proxy_mts.txt"
system "start C:\3proxy_64\bin64\3proxy.exe C:\3proxy_64\bin64\3proxy_tele2.txt"
```
Вот пример уже конкретного конфига, к примеру, 3proxy_beeline.txt

```
daemon 
monitor C:\3proxy_64\bin64\3proxy_beeline.txt

auth none

nserver 192.168.8.1
nscache 65536

logformat "L%d-%m-%Y %H:%M:%S | %U | %C:%c | %R:%r | %Q:%q | %O | %I | %n | %T | %E"
log C:\3proxy_64\log\3proxy_beeline.log D
rotate 30

maxconn 10000

proxy -p1250 -i192.168.1.82 -e192.168.8.100

flush
```
И вот странная штука стала происходит, один софт стал подглючивать при работе с прокси:
02-11-2020 16:59:18 | - | 192.168.1.82:57711 | 192.168.11.1:80 | 192.168.11.1:80 | 323 | 408 | ip.bablosoft.com | GET http://ip.bablosoft.com/ HTTP/1.1 | 00000

Почему это идёт GET запрос, который конечно не даст нужного результата. Причем так происходит изредка, в основном CONNECT идёт, как и должно быть.
Непонятная штука, потому что пока всё работало в одном конфиге и ДНС были прописаны гугловские, такая проблема не встречалась. Как только разнес на отдельные конфиги - появилась и стала часто проявляться. Может у меня что-то некорректно прописано, что и вызывает такую проблему?

**Comment by z3APA3A** [comment]
@Postpuber - попробуй текущий master (не devel), должно быть поправлено.

**Comment by Postpuber** [comment]
@z3APA3A, теперь всё работает, спасибо!

**Comment by enzo266** [comment]
Подскажите, пожалуйста у меня постоянно раз в 20-40 минут меняются external ip (4g модемы).
Как мне настроить что бы новые IP при смене подтягивались в external сами. Не руками же их менять все время)

**Comment by z3APA3A** [comment]
А как меняются ip? можно обновлять конфигурацию прокси ifup-скриптами, например.

**Comment by enzo266** [comment]
все в Win10 работает,
Изначально у модемов нет никаких своих IP. При подключении модем получает внутренний IP подсети провайдера, он же отображается в настройках сетевого интерфейса и на него же мы ссылаемся для работы прокси.
Этот IP периодически меняется каждые 30 минут, и вот отсюда собственно и вырос мой вопрос.
Как мне скриптом или еще как  в Win10 при смене IP модема, автоматом выбраный порт перенаправлять на новый IP/
Или можно ли в настройках выбрать EXTERNAL не IP адресс, а какой-то конкретный сетевой интрфейс, с привязкой например к мак адресу. 
Спасибо 
![321](https://user-images.githubusercontent.com/73064249/98229212-acbd1780-1f6a-11eb-801e-4e322ec413a4.png)

![123](https://user-images.githubusercontent.com/73064249/98229154-9d3dce80-1f6a-11eb-9056-2bb84cfa6fcb.png)

**Comment by Vision20202** [comment]
Этот вопрос опять не по софту. Причем тут меняются IP? Для настройки прокси прописываются IP на самих модемах, жестко закрепляются. Если Вы купили модемы, которые такие настройки не дают, то ничего вы нормально не настроите.

**Comment by z3APA3A** [comment]
Windows не поддерживает биндинг к адаптеру. Так а меняется внешний адрес NAT или именно адрес интерфейса (100.66.189.101)? В команде external надо указывать адрес интерфейса, а не внешний адрес NAT

**Comment by enzo266** [comment]
В том то и дело что у всех модемов, которые работают по проколам MBIM/QMI/NCM  адрес интерфейса назначается провайдером.
Это не модемы NDIS у которых есть еще своя внутренняя маршрутизация.

**Comment by Vision20202** [comment]
> 
> 
> @Vision20202 команда system появилась в самых первых версиях
> 
> @fatory сделай system "start C:\3proxy\bin64\3proxy.exe C:\3proxy\bin64\3proxy1.txt"

Я так понимаю в Linux такой команды нет? В Win всё работает, с отдельным конфигом под каждый прокси, а в Linux получил сообщение: sh: 1: start: not found
Как под линукс подключить свой конфиг прокси?

**Comment by ezbik** [comment]
Как работают множество `nserver ` ? Round-robin? 2-й опрашивается если первый возвращает timeout / NXdomain?

**Comment by z3APA3A** [comment]
@Vision20202 start это команда в cmd.exe, в sh нужен & в конце. Это уже не вопросы по 3proxy.

@ezbik используются по порядку, если не удалось разрешить через предыдущий.

**Comment by Vision20202** [comment]
Вы извините пожалуйста за вопросы мало относящиеся к программе. Но должно быть вот так:
system "/usr/local/3proxy/3proxy /usr/local/3proxy/3proxy_mts.txt" &
т.е. после каждого system? Вроде и без этого работает, но вдруг какие-то проблемы начнутся.

**Comment by Sub-7** [comment]
Sys: Ubuntu 20.04
не хватает пакетов как :  make, gcc чего ещö?

```
:~/3proxy# make
cat Makefile.Linux > src/Makefile.var
make[1]: Entering directory '/root/3proxy/src'
gcc -g  -fPIC -O2 -fno-strict-aliasing -c -pthread -DWITHSPLICE -D_GNU_SOURCE -DGETHOSTBYNAME_R -D_THREAD_SAFE -D_REENTRANT -DNOODBC -DWITH_STD_MALLOC -DFD_SETSIZE=4096 -DWITH_POLL -DWITH_NETFILTER 3proxy.c
In file included from 3proxy.c:9:
proxy.h:18:10: fatal error: stdio.h: No such file or directory
   18 | #include <stdio.h>
      |          ^~~~~~~~~
compilation terminated.
make[1]: *** [Makefile.inc:51: 3proxy.o] Error 1
make[1]: Leaving directory '/root/3proxy/src'
make: *** [Makefile.inc:7: all] Error 2

```

**Comment by Sub-7** [comment]
and: apt-get install libc6-dev

**Comment by z3APA3A** [comment]
@Sub-7 в https://github.com/z3APA3A/3proxy/releases/tag/0.9.1 лежит готовый deb

**Comment by z3APA3A** [comment]
Продолжаем в #561
