### ISSUE TITLE
Transparent HTTPS proxing doesn't work

### ISSUE THREAD

**Issue by IvankoB** [z3APA3A/3proxy#149]
For "http://youtube.com" (internally redirected to "https://youtube.com"), "3proxy" issues  a classic MITM GET-request instead of the expected CONNECT-request thus "https://youtube.com" doesn't handle the such kind of connection.

In non-tansoenet proxing mode (set  in browser settings), "3proxy" issues CONNECT resquest as exprected and everything works well.

PS: the transparent mode in this case is used for "3proxy" to control LAN-clients bandwidth.

**Comment by z3APA3A** [comment]
HTTPS is encrypted, transparent HTTPS can not work without certificate spoofing, because request is not visible for proxy.  You can use SSL plugin to MitM https with certificate spoofing
http://3proxy.ru/plugins/SSLPlugin/
however, I would not recommend to use it inproduction environment.

**Comment by z3APA3A** [comment]
Alternatively, under Linux you can use 
http://3proxy.ru/plugins/TransparentPlugin/
if 3proxy is on the same host which does traffic redirection.

**Comment by IvankoB** [comment]
HTTPS is encrypted, transparent HTTPS can not work without certificate spoofing, because request is not visible for proxy. 
--------------------
Really it's possible without tampering encrypted traffiq with some trickery see https://habrahabr.ru/post/267851/:
...
acl step1 at_step SslBump1
ssl_bump peek step1
ssl_bump terminate blocked 
ssl_bump splice all
...
But the SQUID solution's (really works and only on the3.5.8 version ) performance tends to degrade quickly while real life work

**Comment by z3APA3A** [comment]
Nope, this article describes different problem, it (proably) uses same approach as http://3proxy.ru/plugins/TransparentPlugin/, but allows to filter connections based on hostnames.

Actually, it's still possible to proxy HTTPS transparenty without the need to obtain target from the different source, it's possible to forward requests based on SNI, and this functionality is planned for future. It has some limitations (e.g. port must be known and client must support SNI). But anyway, it has nothing to do with HTTP proxy.

**Comment by IvankoB** [comment]
Anyway we need a realiable HTTPS traffic control solutin for the proxy since 99% of modern media traffiq (which is 99% of the overall world traffiq) is provided by HTTPS based sites.

**Comment by IvankoB** [comment]
http://3proxy.ru/plugins/TransparentPlugin/, 
---------------------
Какова группа настроек "3proxy" для следующего редиректа :

iptables -t nat -A PREROUTING  -p tcp ... --dport 443 -j REDIRECT --to-ports 3129

**Comment by z3APA3A** [comment]
plugin /path/to/TransparentPlugin.ld.so transparent_plugin
...
tcppm -iLOCAL_IP 3129 127.0.0.1 11111

127.0.0.1 11111 в данном случае роли не играют. Редиректить в LOCAL_IP:3129 можно любой TCP трафик, не только https, по любым портам.

**Comment by IvankoB** [comment]
Нужно также правильно изменить (и поставить в правильное место - до или после "tcppm" ?) команду проксирования :

proxy -p3129 -i<192.168.1.1> -n -a -i<192.168.1.1> <133.007.007.007>

Игры с портом "p3129" -> 443|11111 ни к чему не привели. Коннекты ко всем этим портам ессно разрешал.

**Comment by z3APA3A** [comment]
не надо больше никакой команды проксирования. proxy нужен для парсинга HTTP, а здесь его не будет. Будет работать именно tcppm (портмаппинг).

**Comment by z3APA3A** [comment]
Я не знаток Linux, но ИМХО в исходном iptables команда неправильная, должно быть что-то типа
iptables -t nat -I PREROUTING -p tcp --dport 443 -j DNAT --to-destination 127.0.0.1:3129
и чтобы роутить в 127.0.0.1 возможно еще требуется что-то типа
sysctl -w net.ipv4.conf.eth0.route_localnet=1

**Comment by IvankoB** [comment]
root@post229:/etc/network/common# 
-j  DNAT --to-destination 127.0.0.1:3129
------------------
и есть "- j REDIECT --to-ports 3129"


sysctl -w net.ipv4.conf.eth0.route_localnet=1
-----------------------
Перепробовал все варианты *.accept_local & *.route_localnet - не помогло.


tail -f /var/log/3proxy/3proxy.log.2017.04.06
Никакой активности после :
-----------------------
1491489216.521 SOCKS.3381 00000 - 192.168.1.229:3381 213.230.108.220:0 0 0 0 Accepting_connections_[27508/3078314816]
1491489216.522 SOCKS.3381 00000 - 213.230.108.220:3381 213.230.108.220:0 0 0 0 Accepting_connections_[27508/3076373312]
1491489216.523 PROXY.3128 00000 - 192.168.1.229:3128 213.230.108.220:0 0 0 0 Accepting_connections_[27508/3073375040]
1491489216.524 PROXY.3130 00000 - 192.168.1.229:3130 213.230.108.220:0 0 0 0 Accepting_connections_[27508/3073342272]
1491489216.525 TCPPM.3129 00000 - 192.168.1.229:3129 0.0.0.0:0 0 0 0 Accepting_connections_[27508/3073309504]
1491489296.478 PROXY.3130 00000 - 192.168.1.1:60766 83.169.197.209:80 429 746 0 POST_http://clients1.google.com/ocsp_HTTP/1.1
1491489296.588 TCPPM.3129 00093 - 192.168.1.1:38670 127.0.0.1:11111 0 0 0
1491489296.672 PROXY.3130 00000 - 192.168.1.1:60768 83.169.197.209:80 429 746 0 POST_http://clients1.google.com/ocsp_HTTP/1.1
1491489296.682 TCPPM.3129 00093 - 192.168.1.1:45936 127.0.0.1:11111 0 0 0
1491489299.298 TCPPM.3129 00093 - 192.168.1.1:59728 127.0.0.1:11111 0 0 0
1491489310.434 PROXY.3130 00000 - 192.168.1.1:33338 5.61.23.5:80 328 131 0 GET_http://ok.ru/_HTTP/1.1
1491489310.437 TCPPM.3129 00093 - 192.168.1.1:33362 127.0.0.1:11111 0 0 0


Браузер ругнулся:
-----------------------
The connection to support.mozilla.org was interrupted while the page was loading.
    The page you are trying to view cannot be shown because the authenticity of the received data could not be verified.
    Please contact the website owners to inform them of this problem.
Learn more…

TCPDUMP показывает,что 2-сторонний сеанс с сайтом через прокси все-таки инициировался:
------------------
19:57:44.646087 IP <lan_client>.49490 > ip5.23.odnoklassniki.ru.https: Flags [S], seq 1481863100, win 29200, options [mss 1460,sackOK,TS val 26619209 ecr 0,nop,wscale 7], length 0
19:57:44.646112 IP ip5.23.odnoklassniki.ru.https > <lan_client>.49490: Flags [S.], seq 334514112, ack 1481863101, win 28960, options [mss 1460,sackOK,TS val 37549647 ecr 26619209,nop,wscale 8], length 0
19:57:44.646743 IP <lan_client>.49490 > ip5.23.odnoklassniki.ru.https: Flags [.], ack 1, win 229, options [nop,nop,TS val 26619209 ecr 37549647], length 0
19:57:44.646887 IP ip5.23.odnoklassniki.ru.https > <lan_client>.49490: Flags [F.], seq 1, ack 1, win 114, options [nop,nop,TS val 37549647 ecr 26619209], length 0
19:57:44.647025 IP <lan_client>.49490 > ip5.23.odnoklassniki.ru.https: Flags [P.], seq 1:180, ack 1, win 229, options [nop,nop,TS val 26619209 ecr 37549647], length 179
19:57:44.647054 IP ip5.23.odnoklassniki.ru.https > <lan_client>.49490: Flags [R], seq 334514113, win 0, length 0
19:57:44.647303 IP <lan_client>.49490 > ip5.23.odnoklassniki.ru.https: Flags [F.], seq 180, ack 2, win 229, options [nop,nop,TS val 26619210 ecr 37549647], length 0
19:57:44.647314 IP ip5.23.odnoklassniki.ru.https > <lan_client>.49490: Flags [R], seq 334514114, win 0, length 0

**Comment by IvankoB** [comment]
192.168.1.1 - клиент
192.168.1.229 - рутер

**Comment by IvankoB** [comment]
и есть "- j REDIECT --to-ports 3129"
=============
Оопс - не одно и тоже "-j REDIRECT" перекидывает не на локалхост, а на свой интерфейс. Сейчас проверю...

**Comment by z3APA3A** [comment]
Убедись еще что ты исходящий трафик от прокси обратно в него не загоняешь.

**Comment by IvankoB** [comment]
Все работает, но первый коннект (к любому HTTPS) устанавливается весьма долго, затем все HTTPS-коннекты устанавливаются быстро. Плагин в лог ничего не пишет, хорошо что решил подождать полминуты.
Манипуляции с SYSCTL оказались не нужны - достаточно стандартного IPTABLESкого разрешенния коннектов к 127.0.0.1:3129.

ПС: побочный эффект - браузер теперь не коннектится если явно задана прокся. Видимо надо разводить по портам прозрачный и непрозрачный коннекты.

**Comment by z3APA3A** [comment]
По портам - да, разумеется надо разводить. и proxy ставь до плагина, а tcppm - после. Вешать proxy и tcppm на один порт можно, но только если на разные интерфейсы.
Откуда долгий коннект может взяться - не представляю, tcppm очень просто работает, получил - тут же отправил, т.е. тормозить может только на установке коннекта. Проверь что в итоге по правилам получилось, нет ли где каких-то зацикливаний.
Еще тормозить может из-за разрешения имен, проверь конфигурацию резолвера.

**Comment by IvankoB** [comment]
Все работает, но первый коннект (к любому HTTPS)
---------------------
Это (1-я страница открывается почти минуту, остальные - быстро) касается и HTTP  - видно это касается лобого типа прозрачного WWW-проксирования через плагин.

**Comment by z3APA3A** [comment]
так если ты прокси запускаешь до плагина, то на него плагин никак влиять не может.

**Comment by z3APA3A** [comment]
в конфиге что сейчас?

**Comment by IvankoB** [comment]
Еще тормозить может из-за разрешения имен, проверь конфигурацию резолвера.
========================
У нас DNS-ы реально медленные - но не настолько. Сейчас 2 записи:
nameserver 127.0.0.1 /// DNSMASQ
namesever 8.8.8.8

Как они интепретируются ?

**Comment by IvankoB** [comment]
log /var/log/3proxy/3proxy.log D
logformat "- +_L%t.%. %N.%p %E %U %C:%c %R:%r %O %I %h %T"
rotate 2
archiver gz /bin/gzip %F
setuid 65534
daemon
maxconn 16384

nserver localhost
nserver 8.8.8.8
nscache 65536

users "....:CR:..." ".....:CR:..."

nobandlimin * * 192.168.1.239
nobandlimout * * 192.168.1.239
bandlimin  100000 * 192.168.1.0/24
bandlimout 100000 * 192.168.1.0/24

allow * 192.168.1.0/24,...
deny *

auth strong
socks -p3381 -i192.168.1.229 -e<ext>
socks -p3381 -i<ext> -e<ext>
users ...:CL:...
proxy -p3128 -n -a -i192.168.1.229 -e<ext>
proxy -p3129 -n -a -i192.168.1.229 -e<ext>

auth iponly
plugin /usr/local/lib/TransparentPlugin.ld.so transparent_plugin
tcppm -i192.168.1.229 3130 127.0.0.1 11111
tcppm -i192.168.1.229 3131 127.0.0.1 11112

**Comment by IvankoB** [comment]
-e => {ext_address}

**Comment by z3APA3A** [comment]
nserver localhost
лучше все-таки прописать как
nserver 127.0.0.1
и предварительно попробовать на нем что-нибудь разрешить. Сейчас все запросы идут на 127.0.0.1 и в случае таймаута опрашивается 8.8.8.8

**Comment by z3APA3A** [comment]
подозреваю что 127.0.0.1 не работает, поэтому и тормоза.

**Comment by IvankoB** [comment]
telnet 127.0.0.1 53  => OK

в случае таймаута опрашивается 8.8.8.8
=================
По TCP или UDP ?

**Comment by IvankoB** [comment]
# nslookup ok.ru
Server:         127.0.0.1
Address:        127.0.0.1#53

Non-authoritative answer:
Name:   ok.ru
Address: 217.20.155.58
Name:   ok.ru
Address: 217.20.156.159
Name:   ok.ru
Address: 5.61.23.5

**Comment by IvankoB** [comment]
Может стоит добавить в плагины кое-какой логгинг ? 
Хотя бы увидим зацикливания и таймауты.

**Comment by z3APA3A** [comment]
Там нечего логать, он делает getsockopt() с SO_ORIGINAL_DST, это неблокирующий вызов, он не может приводить к задержкам. Попробуй таким же образом замапить любой другой порт, например 25 и просто установи соединение по 25му порту телнетом, посмотри что при этом будет в логах.

**Comment by IvankoB** [comment]
Таким образом можно прозрачно проксить коннекты на любой исходящий порт ? Чтобы например зажимать-балансировать скорость загрузки мэйл-аттачей. 
(жаль что такого стандартного порта нет у торрента)

**Comment by z3APA3A** [comment]
Да, можно.
Ну ты можешь зарезать все неизвестные порты, с большой долей вероятности это и будут торренты.
