### ISSUE TITLE
Transparent TLS Proxy issue

### ISSUE THREAD

**Issue by john-d13** [z3APA3A/3proxy#406]
Hello,

Currently using redsocks2 to redirect inbound connections to upstream proxy with combination of iptables prerouting rules.   Trying to replace with 3proxy using transparent plugin.   Using latest devel version 0.9 which should be built in function.

The inbound connections are via OpenVPN TUN0 Interface

Config:

auth none
allow *
parent 1000 connect 191.96.26.26 3128
maxconn 5000
tcppm -i0.0.0.0 10514 127.0.0.1 11111

netstat -tulpn
Active Internet connections (only servers)
Proto Recv-Q Send-Q Local Address           Foreign Address         State       PID/Program name
tcp        0      0 0.0.0.0:10514           0.0.0.0:*               LISTEN      22096/3proxy

iptables -t nat -L -n
Chain PREROUTING (policy ACCEPT)
target     prot opt source               destination
REDSOCKS   tcp  --  0.0.0.0/0            0.0.0.0/0

Chain POSTROUTING (policy ACCEPT)
target     prot opt source               destination
MASQUERADE  all  --  0.0.0.0/0            0.0.0.0/0

Chain REDSOCKS (1 references)
target     prot opt source               destination
RETURN     all  --  0.0.0.0/0            10.0.0.0/8
RETURN     all  --  0.0.0.0/0            127.0.0.0/8
RETURN     all  --  0.0.0.0/0            192.168.0.0/16
RETURN     all  --  0.0.0.0/0            172.16.0.0/12
RETURN     all  --  0.0.0.0/0            0.0.0.0/8
REDIRECT   tcp  --  10.66.77.22          0.0.0.0/0            redir ports 10514

I see the connections being steered to the 3proxy listening port 10514 and outbound connections to parent proxy but the connection breaks.  

1575388771.993 TCPPM.10514 00033 - 10.66.77.22:57451 191.96.26.26:3128 0 391 1 127.0.0.1
1575388771.996 TCPPM.10514 00033 - 10.66.77.22:57455 191.96.26.26:3128 0 391 1 127.0.0.1
1575388773.632 TCPPM.10514 00033 - 10.66.77.22:57456 191.96.26.26:3128 0 391 1 127.0.0.1
1575388774.044 TCPPM.10514 00033 - 10.66.77.22:57457 191.96.26.26:3128 0 391 1 127.0.0.1
1575388774.459 TCPPM.10514 00033 - 10.66.77.22:57458 191.96.26.26:3128 0 391 1 127.0.0.1
1575388780.534 TCPPM.10514 00033 - 10.66.77.22:57459 191.96.26.26:3128 0 391 1 127.0.0.1

tcpdump -i eth0 host 191.96.26.26 -nn
tcpdump: verbose output suppressed, use -v or -vv for full protocol decode
listening on eth0, link-type EN10MB (Ethernet), capture size 65535 bytes
11:00:10.116110 IP 157.230.83.188.18424 > 191.96.26.26.3128: Flags [S], seq 2145895419, win 42340, options [mss 1460,sackOK,TS val 2024585855 ecr 0,nop,wscale 11], length 0
11:00:10.231458 IP 191.96.26.26.3128 > 157.230.83.188.18424: Flags [S.], seq 1292468805, ack 2145895420, win 14480, options [mss 1460,sackOK,TS val 1015050282 ecr 2024585855,nop,wscale 9], length 0
11:00:10.231537 IP 157.230.83.188.18424 > 191.96.26.26.3128: Flags [.], ack 1, win 21, options [nop,nop,TS val 2024585971 ecr 1015050282], length 0
11:00:10.241706 IP 157.230.83.188.18424 > 191.96.26.26.3128: Flags [P.], seq 1:61, ack 1, win 21, options [nop,nop,TS val 2024585981 ecr 1015050282], length 60

I try adding the "transparent" directive in the 3proxy.cfg but it complains the attribute is unknown.  Not sure if there are any additional steps to enable the function to work properly. 

3proxy -v
3proxy tiny proxy server 3proxy-0.9-devel ()

**Comment by z3APA3A** [comment]
https://3proxy.ru/faqe.asp

Q: Why restrictions (redirections, limits, etc) do not work?
A: Most probable reasons: **'auth none'** or no auth is used. For any ACL based feature one of 'iponly', 'nbname' or 'strong' auths required....

**Comment by z3APA3A** [comment]
TransparentPlugin is, of cause, required in this configuration.

**Comment by john-d13** [comment]
thank you,  working now.

Is the following attributes required?  What is the purpose of adding "transparent".  I tested with and without and both cases it works.

transparent <<<<
tcppm -i0.0.0.0 10514 127.0.0.1 11111
notransparent <<<<

**Comment by z3APA3A** [comment]
Without TransparentPlugin it will always connect to 127.0.0.1 11111 via parent proxy.

**Comment by john-d13** [comment]
Transparent proxy plugin generating very high CPU when upstream network connections are greater than 50Mbps.  

3proxy-0.9-devel

![11](https://user-images.githubusercontent.com/37522919/70168570-21bb0980-1697-11ea-9008-85e309b488eb.png)

**Comment by z3APA3A** [comment]
https://3proxy.ru/highload.asp

**Comment by z3APA3A** [comment]
75% CPU is consumed by system, check "Using 3proxy in virtual environment". Also, it may be a result of running system in energy saving power profile or large CPU usage by VPN.

**Comment by john-d13** [comment]
Appreciate the support.  I applied suggested settings and CPU has stabilized.  Good work :)

Ref:
tcppm -osTCP_NODELAY -ocTCP_NODELAY -s0 -i0.0.0.0 10710 127.0.0.1 11111
